Console,Title,Release_Date,ESRB,Publisher,Developer,Genre,UPC,PC_ID,Summary,URL
gameboy-advance,007 Everything or Nothing,11/1/2003,Teen,Electronic Arts,Griptonite Games,Action & Adventure,014633147179,2162,"Think like Bond, act like Bond, and experience an entirely new Bond adventure. James Bond, the world's greatest secret agent, returns in Everything or Nothing with new guns and gadgets, combat skills, and clever tricks--and it's up to you to put them to good use. Travel through four exciting continents including the Valley of the Kings in Egypt and the French Quarter in New Orleans. The game also features two-player co-op missions and four-player multiplayer arena modes.",https://www.pricecharting.com/game/gameboy-advance/007-everything-or-nothing
gameboy-advance,007 Nightfire,3/1/2003,Teen,Electronic Arts,JV Games,Action & Adventure,014633146226,2418,"The ultimate secret agent is back in his most dangerous adventure yet in James Bond 007: NightFire. Explore new heights and depths like never before -- infiltrate towering skyscrapers, take on treacherous underwater missions, and tackle original missions including assignments in outer space. All this plus glamorous (and sometimes deadly) Bond women, new state-of-the-art gadgets and weapons, and an advanced in-game camera system will leave you shaken and stirred.",https://www.pricecharting.com/game/gameboy-advance/007-nightfire
gameboy-advance,2 Games in 1 Double Pack: SpongeBob,9/8/2006,Everyone,THQ,"Climax Studios, Vicarious Visions ",Compilation,7.85138E+11,16139,"The SpongeBob SquarePants Double Pack features the Revenge of the Flying Dutchman and SuperSponge games for the Game Boy Advance. Now you can either help SpongeBob find lost treasures hidden throughout Bikini Bottom or help him gather celebrity autographs to give to Patrick Star for his birthday. Throughout your adventures, you'll encounter various characters and locations based on the SpongeBob SquarePants animated series.",https://www.pricecharting.com/game/gameboy-advance/2-games-in-1-double-pack-spongebob
gameboy-advance,2006 FIFA World Cup,4/24/2006,Everyone,Electronic Arts,EA Canada,Soccer,014633152029,11066,"2006 FIFA World Cup features 12 official stadiums used at 2006 FIFA World Cup Germany and stadiums from each qualifying region. Gamers can play as their favorite team from qualification right through to a virtual reproduction of the tournament in Germany. With enhanced player animations, EA SPORTS has emulated close to 100 of the world's superstars, capturing their playing styles and individual likenesses. In addition to enabling gamers to participate in the 2006 FIFA World Cup Germany by taking control of one of 127 national teams, the game features new compelling modes of play, including the groundbreaking Global Challenge that tests even the most hardcore soccer fan by recreating classic moments in FIFA World Cup history. Furthermore, the game supports up to eight-way multiplayer matches and features a plethora of in-game unlockable content such as legendary players and exclusive apparel.",https://www.pricecharting.com/game/gameboy-advance/2006-fifa-world-cup
gameboy-advance,3-in-1 Rec Room Challenge,12/12/2005,Everyone,Majesco,Skyworks Technologies,Sports,096427014614,11338,"Now you can challenge yourself with three popular recreational games, all on one Game Pak! Fine-tune your aim in classic dart games, master strikes and spares in Shuffle Bowling and connect with targets in Roll-a-Ball to net the high score!",https://www.pricecharting.com/game/gameboy-advance/3-in-1-rec-room-challenge
gameboy-advance,3-in-1 Sports Pack,12/1/2005,Everyone,Majesco,Skyworks Technologies,Sports,096427014522,11336,"The ultimate handheld sporting experience is here! Hit the lanes with your favorite ball in Big Alley Bowling, lead your team to victory in Dodgeball: Dodge This!, and use your stealth and accuracy to defeat the opposition in Paintball: Splat! Link up with three of your friends to enjoy the action of compete in single player mode to win it all!",https://www.pricecharting.com/game/gameboy-advance/3-in-1-sports-pack
gameboy-advance,3D Pool,11/1/2004,Everyone,Ignition Entertainment,Ignition Entertainment ,Sports,8.93384E+11,1964,"Join world renowned pool game designer Archer Maclean at the table in ARCHER MACLEAN'S 3D POOL for the Game Boy Advance. This virtual pool game by Ignition Entertainment puts players up against 20 different computer adversaries or against other players in a true three dimensional environment. The one-player mode features several different options. Players can select to use either coin-op or professional rules. Both American and UK variations of the game are available as well. A rule editor feature allows players to pick and choose which of the different rules will be in effect for the game. A trick-shot table editor gives players a chance to set trick shot options. Pool fans will be pleased at the game's graphics and smoothness, and while some pool games occasionally defy the laws of physics, ARCHER MACLEAN'S 3D POOL is nearly flawless, perfectly simulating every shot. The free camera can be positioned almost anywhere around the table, letting players find that perfect angle to line up their shots. In addition to the one-player mode, a multiplayer option lets players run a tournament for up to eight players. With this multiplayer feature, the many game options, and the amazing graphics, gamers and pool fans alike will be ready to rack 'em and sink 'em with ARCHER MACLEAN'S 3D POOL.",https://www.pricecharting.com/game/gameboy-advance/3d-pool
gameboy-advance,A Sound of Thunder,2/1/2005,Teen,Bam Entertainment,Mobius Entertainment,Action & Adventure,6.82384E+11,1965,"Based on the Franchise Pictures movie of the same name, A Sound of Thunder takes you to a future where time travel is possible. Things quickly go wrong when someone alters the past, creating a sequence of time ripples that mutate the present-day world. Now you must solve the mystery and sort out a mess that just might mean the end of human existence. You'll solve puzzles, manipulate items, interact with other characters, and eliminate mutant creatures and plants. In addition to a single-player mode, the game features both cooperative and competitive multiplayer modes.",https://www.pricecharting.com/game/gameboy-advance/a-sound-of-thunder
gameboy-advance,Ace Combat Advance,2/23/2005,Everyone,Namco,Human Soft,Action & Adventure,7.22675E+11,10954,"The Ace Combat series makes its debut on the Game Boy Advance with challenging missions, unlockable planes, and free-roaming environments. As the newest pilot in an elite fighter squadron, you must help destroy the Air Strike Force--the military arm of an evil multinational corporation. If you destroy enough enemy planes during your missions, you'll unlock new planes. Fly in air-to-air and air-to-ground missions over arctic, forest, and desert environments. Each environment features destructible buildings and objects.",https://www.pricecharting.com/game/gameboy-advance/ace-combat-advance
gameboy-advance,Activision Anthology,12/9/2003,Everyone,Aspyr,Aspyr,Arcade,6.1887E+11,1967,"Be a flying ace, a race car champion, a tennis star, and a space pioneer all in one afternoon. Activision Anthology lets you go back in time with all your old favorites, including Pitfall 1 and 2, Commando, Freeway, Keystone Kapers, Seaquest, River Raid 1 and 2, and Spider Fighter. Whether it's trying to get Pitfall Harry past the third pit on the right or breaking 15,000 points on River Raid to earn a patch, Activision Anthology is sure to conjure plenty of gaming memories.",https://www.pricecharting.com/game/gameboy-advance/activision-anthology
gameboy-advance,Advance Guardian Heroes,9/14/2004,Everyone,Ubisoft,Treasure,Action & Adventure,008888142096,1968,"Based on the Sega Saturn's Guardian Heroes, Advance Guardian Heroes brings a classic game to life on your Game Boy Advance. Not your ordinary side-scrolling fighter, the game features more than 20 playable characters, 160 powerful moves, and different multiplayer scenarios. Each fighter has unique moves and abilities, which you can upgrade as you progress through the game. Whether you play solo, with friends, or against friends, you can delve into a variety of challenges and battle arenas.",https://www.pricecharting.com/game/gameboy-advance/advance-guardian-heroes
gameboy-advance,Advance Wars,9/9/2001,Everyone,Nintendo,Intelligent Systems,Strategy,045496731458,1969,"Advance Wars is a turn-based strategy video game developed for the Game Boy Advance by Intelligent Systems and published by Nintendo. It was released in North America on September 10, 2001. The game's release in Japan and Europe was delayed, supposedly due to the September 11 attacks in the United States. Although the game was released in Europe in January 2002, neither GBA title was released in Japan until the Game Boy Wars Advance 1+2 compilation in 2004. Advance Wars has been released for the Wii U Virtual Console simultaneously in Europe and North America on April 3, 2014.",https://www.pricecharting.com/game/gameboy-advance/advance-wars
gameboy-advance,Advance Wars 2,6/1/2003,Everyone,Nintendo,Intelligent Systems,Strategy,045496733124,1970,Advance Wars 2: Black Hole Rising is a turn-based strategy video game for the Game Boy Advance. It was developed by Intelligent Systems and published by Nintendo in 2003. It is the second game in the Advance Wars sub-series of Nintendo Wars. It is preceded by Advance Wars and followed by Advance Wars: Dual Strike.,https://www.pricecharting.com/game/gameboy-advance/advance-wars-2
gameboy-advance,Aero the Acro-Bat,5/14/2002,Everyone,Metro 3d,Unkown,Action & Adventure,6.50002E+11,10937,"Aero the Acrobat, the classic Sunsoft game for Super NES, comes to Game Boy Advance! Edgar Ektor (and evil ex-circus clown) has booby-trapped the circus with the help of a crazy flying squirrel named Zero and his fairground henchmen. Only Aero, a master of acrobatics, can diffuse the dangers of the circus and perform various death defying acts to amuse the unsuspecting audience. As the headlining act, Aero will walk tightropes, swing on trapezes, blast out of cannons and plunge off the high dive in order to find Ektor and put a stop to his evil plans.",https://www.pricecharting.com/game/gameboy-advance/aero-the-acro-bat
gameboy-advance,Agassi Tennis Generation,8/1/2003,Everyone,Unkown,Unkown,Sports,6.25904E+11,1971,"Agassi Tennis Generation brings you up close and personal to the biggest stars in tennis. Play as Andre Agassi, or compete against him, as you smash, volley, lob, and serve on courts from all over the world in 16 tournaments. The game features 32 unique players with realistic movements, various court surfaces, and three challenging game modes including Quick Match, Arcade, and Tournament. Can you win your way to the top ranks of tennis stardom?",https://www.pricecharting.com/game/gameboy-advance/agassi-tennis-generation
gameboy-advance,Aggravation / Sorry /  Scrabble Jr,8/1/2005,Everyone,DSI Games,Gravity-I,Party,8.02068E+11,1972,"Sorry!
Sorry!, the classic game of slide and pursuit, has been supercharged for Game Boy Advance! Be the first player to move all four of your pawns around the game board from Start to Home.
Aggravation
Be the first player to move all four of your colored marbles around the game board from Base to Home. You don't have to 'Aggravate' the other players to win, but it sure helps! Aggravation can be played by 1 to 6 players.
Scrabble Junior
Get ready for your very own Game Boy Advance version of the famous crossword game! Cover the game board letters with matching letter tiles, and score points by completing words.",https://www.pricecharting.com/game/gameboy-advance/aggravation-sorry-scrabble-jr
gameboy-advance,Aggressive Inline,8/27/2002,Everyone,Acclaim,Unkown,Extreme Sports,021481522935,1973,"In Aggressive Inline the player takes the role of one of nine real-life skaters with one specific goal: receiving as much points as possible by performing spectacular stunts. Every of the 13 courses also has various special challenges, e.g. collecting or smashing certain items, which need to be performed to beat it. In contrast to the open areas of the console versions this one features more linear levels and tight time limits.",https://www.pricecharting.com/game/gameboy-advance/aggressive-inline
gameboy-advance,Air Hockey E-Reader,1/1/2004,Everyone,Unkown,Unkown,Other,045496714994,42392,"Promo card containing a simple air hockey game, distributed to promote the e-Reader device for Game Boy Advance",https://www.pricecharting.com/game/gameboy-advance/air-hockey-e-reader
gameboy-advance,Airforce Delta Storm,9/16/2002,Everyone,Konami,Unkown,Simulation,083717500377,11289,"Strap into your cockpit and blast through the gut-wrenching world of flight combat. Your adrenaline pumps as machine gun fire pelts off your tail, you execute back-breaking barrel rolls and experience dog-fighting action. Take your pick of over 70 planes, including military fighters rendered from actual aircraft. With a full range of extreme missions to numb your senses, AirForce Delta Storm pushes your Game Boy Advance to the sky!",https://www.pricecharting.com/game/gameboy-advance/airforce-delta-storm
gameboy-advance,Aladdin,9/28/2004,Everyone,Capcom,Unkown,Action & Adventure,013388280186,1974,"Based on the classic game for the SNES and Disney's animated film, Disney's Aladdin joins the Game Boy Advance library with all-new features. In this side-scrolling platform game, you'll take the role of Aladdin and his mischievous monkey, Abu, as they throw apples, climb ropes, and ride magic carpets to find out their destinies. Disney's Aladdin features a bonus stage for each level and a variety of environments to explore, including Jafar's castle, the Genie's lamp, and an ancient pyramid.",https://www.pricecharting.com/game/gameboy-advance/aladdin
gameboy-advance,Alex Rider Stormbreaker,10/2/2006,Everyone 10+,THQ,Unkown,Action & Adventure,7.85138E+11,11651,"Based on Anthony Horowitz's series of teen spy movies and movie following adventure-seeker Alex Rider. Players embrace the role of Alex Rider to out-spy, outwit and out-cool evil in this thrilling action adventure. Featuring third-person stealth game play, fast-paced racing action, intense fighting and engaging, gadget-based mini-games, players can relive defining moments from the Stormbreaker movie and become the ultimate spy.",https://www.pricecharting.com/game/gameboy-advance/alex-rider-stormbreaker
gameboy-advance,Alienators Evolution Continues,11/13/2001,Everyone,Activision,Unkown,Action & Adventure,047875802858,1975,"You thought you'd rid the Earth of the aliens. But now they're back, and the evolution of hostile life-forms continues. Lucky for Earth, the Alienators are on the job. Use all the alien-butt-kicking science within your grasp to battle the Genus... before this evil evolves to a state of total supremacy and succeeds in global domination!",https://www.pricecharting.com/game/gameboy-advance/alienators-evolution-continues
gameboy-advance,All-Star Baseball 2003,5/31/2002,Everyone,Jack of All Games,Unkown,Baseball,021481522812,1977,"Featuring four-time World Series Champion Derek Jeter, All-Star Baseball 2003 features many exciting new modes of play and options that deliver unparalleled hardball realism. Building upon proven success, All-Star Baseball 2003 combines the perfect blend of simulation style hardball for the baseball fanatic, with the ease of use for the casual sports gamer.",https://www.pricecharting.com/game/gameboy-advance/all-star-baseball-2003
gameboy-advance,All-Star Baseball 2004,2/1/2003,Everyone,Acclaim,Unkown,Baseball,021481523123,1978,"Like Derek Jeter, All-Star Baseball 2004 is the game with all the tools. With the most realistic simulation ever, easier to play functionality, and the same all around skill set that makes Derek the leader and winner he is, ASB 2004 truly is the game with all the tools.",https://www.pricecharting.com/game/gameboy-advance/all-star-baseball-2004
gameboy-advance,Altered Beast Guardian of the Realms,11/23/2002,Teen,Sega,Unkown,Action & Adventure,7.85138E+11,1979,"Zeus, creator and ruler of the Guardians of the Gates, raises you from your grave! You must go fourth and defeat a new, unknown evil that has destroyed the Guardians and ravaged the universe. To do so, you must collect the keys and Essence of each land, transforming you into beasts with unnatural powers and special abilities. Conquer this evil and you will become the sole Guardian, the protector of the universe.",https://www.pricecharting.com/game/gameboy-advance/altered-beast-guardian-of-the-realms
gameboy-advance,Amazing Virtual Sea-Monkeys,,Everyone,Swing! Entertainment,ELO Interactive Media,Action & Adventure,8.15315E+11,18709,"The player controls Nautila, a babelfish which is used to indirectly influence the environment within a huge water tank. Nautila has to suck up dangerous fish, clear rocks, supply food etc. for brine shrimps resembling the Sea Monkeys brand. The Sea Monkeys try to reach a Venus Shell as soon as they are hatched. If Nautila is not fast enough to clear the puzzles preventing the Sea Monkeys from reaching their shell, they will perish... The game features 70 levels in total, with increasingly difficult objectives.",https://www.pricecharting.com/game/gameboy-advance/amazing-virtual-sea-monkeys
gameboy-advance,American Bass Challenge,12/5/2001,Everyone,Ubisoft,Unkown,Sports,008888140122,1980,Hook up with the biggest bass in this ultimate rod n' reel challenge. The most thrilling fishing experience you'll get on 32 bits!,https://www.pricecharting.com/game/gameboy-advance/american-bass-challenge
gameboy-advance,American Dragon Jake Long Rise of the Huntsclan,10/12/2006,Everyone 10+,Disney,Unkown,Action & Adventure,7.12725E+11,10975,"Jake Long's most fierce enemy, Dark Dragon, takes Rose, Jake's love interest, hostage in order to cause Jake's destruction in Disney's American Dragon: Jake Long, Attack of the Dark Dragon. When Dark Dragon realizes the evil Huntsman also has an interest in rescuing his hostage, the ultimate duel ensues. Players battle their way through an onslaught of villains that pour in from every direction to save Rose in the process.",https://www.pricecharting.com/game/gameboy-advance/american-dragon-jake-long-rise-of-the-huntsclan
gameboy-advance,American Idol,11/18/2003,Everyone,Konami,MÃ¶bius Entertainment,Music,7.67649E+11,1981,"Complete with a computer generated Randy Jackson, Paula Abdul, and Simon Cowell, with trademark insults, American Idol is a music-based, rhythm-action game that will allow you to create, style, and train a contestant for the competition. Once styled and trained you'll see your contestant progress through the auditions, various heats, and then, hopefully, make it to the grand final. You'll need quick fingers as you match the right combination of buttons to what's displayed on the screen helping your contestant sing a sweet harmony and dance to the rhythm of the song. Get it wrong and your voice fades and goes out of tune as the judges and later the audience grow unsettled.",https://www.pricecharting.com/game/gameboy-advance/american-idol
gameboy-advance,An American Tail Fievel's Gold Rush,5/2/2003,Everyone,SVG Distribution,Unkown,Action & Adventure,8.15315E+11,10398,"Fievel Mousekewitz, a rodent with an immigration card, is heading west in An American Tail: Fievel's Gold Rush. Based on the animated series from Universal Studios, the game has players controlling Fievel as he travels through 18 levels and six worlds, including New York City and Gold Dust Gulch, to piece together Cat Malone's treasure map. Fievel will swing on rope, attack with his ten-gallon hat, ride riverboats, and jump the train to find Wylie Burp's gold.",https://www.pricecharting.com/game/gameboy-advance/an-american-tail-fievel%27s-gold-rush
gameboy-advance,Animal Crossing Series 1 E-Reader,1/1/2004,Everyone,Nintendo,Unkown,Other,045496732165,42393,"Series 1 is the first set of e-Reader cards for Animal Crossing, released in October 2002.",https://www.pricecharting.com/game/gameboy-advance/animal-crossing-series-1-e-reader
gameboy-advance,Animal Crossing Series 2 E-Reader,1/1/2002,Unkown,Nintendo,Unkown,Other,045496732288,35847,"Series 2 is the second set of e-Reader cards for Animal Crossing, released in January 2003.",https://www.pricecharting.com/game/gameboy-advance/animal-crossing-series-2-e-reader
gameboy-advance,Animal Crossing Series 3 E-Reader,1/1/2002,Unkown,Nintendo,Unkown,Other,045496732394,35846,"Series 3 is the second set of e-Reader cards for Animal Crossing, released in January 2003.",https://www.pricecharting.com/game/gameboy-advance/animal-crossing-series-3-e-reader
gameboy-advance,Animal Crossing Series 4 E-Reader,1/1/2002,Unkown,Nintendo,Unkown,Other,045496733186,35848,"Series 4 is the second set of e-Reader cards for Animal Crossing, released in January 2003.",https://www.pricecharting.com/game/gameboy-advance/animal-crossing-series-4-e-reader
gameboy-advance,Animal Snap,11/1/2002,Everyone,Unkown,Unkown,Action & Adventure,8.93384E+11,11823,"Animal Snap is a puzzle game, developed by Awesome Developments and published by Ignition Entertainment, which was released in 2002.",https://www.pricecharting.com/game/gameboy-advance/animal-snap
gameboy-advance,Ant Bully,7/24/2006,Everyone,Midway,Unkown,Action & Adventure,031719191567,7265,"Go pick on someone your own size! After bullying an innocent ant colony, a young boy named Lucas is magically shrunk down to ant size and embarks on a remarkable adventure. Play as Lucas, experiencing the dangerous and thrilling life of an ant as you battle, explore and forge new friendships with natives and other species in his new ant world. Help Lucas evolve from recluse to hero in his quest to save the colony from extermination. Based on the exciting moments from Warner Bros CG animated movie directed by John A. Davis (of the Jimmy Neutron: Boy Genius series.)",https://www.pricecharting.com/game/gameboy-advance/ant-bully
gameboy-advance,Antz Extreme Racing,11/20/2002,Everyone,Jack of All Games,Unkown,Racing,020626715898,1982,"0.5 MPH is extremely fast, when your vehicle is only big enough to carry an ant! Jockey for first place with your favorite character from the hit motion picture Antz™, using vehicles that aren't your typical garden variety.",https://www.pricecharting.com/game/gameboy-advance/antz-extreme-racing
gameboy-advance,Arctic Tale,10/10/2007,Everyone,DSI Games,Atomic Planet Entertainment,Action & Adventure,8.02068E+11,11739,"The far North of our planet is one of the most perilous environments in the world. Take on the role of either a young Polar Bear or a Walrus growing up and trying to survive in the wild. From eating to fighting off predators, almost every aspect of the animal's life is presented to the player. Learning to live in this world is vital as they go from the regular dangers to the extreme threats. Experience the thrilling, interactive look at the walrus and polar bears that roam the vast world of the Arctic wilderness.",https://www.pricecharting.com/game/gameboy-advance/arctic-tale
gameboy-advance,Army Men Advance,6/10/2001,Everyone,3DO,Unkown,Action & Adventure,7.90562E+11,1983,"Plastro, the infamous leader of the Tan Army, has recruited alien forces from another world to aid in his ongoing war against the Green Nation. It's up to Sarge and Vikki G. to jump into action to save their troops from a variety of unknown enemies, and then track down Plastro himself for a final confrontation!",https://www.pricecharting.com/game/gameboy-advance/army-men-advance
gameboy-advance,Army Men Operation Green,12/2/2001,Everyone,Unkown,Unkown,Action & Adventure,7.90562E+11,11700,"The Tan Army is back?you must defeat each and every one of them, destroy the secret device and lead the Green Army to victory. The first Army Men title to bring realistic military action and combat to the Game Boy Advance!",https://www.pricecharting.com/game/gameboy-advance/army-men-operation-green
gameboy-advance,Army Men Turf Wars,9/29/2002,Teen,3DO,Unkown,Action & Adventure,7.90562E+11,11698,"Colonel Grimm has ordered the defeat of the Tan Army and chosen a two-man Special Forces team for the mission. This Special Forces team will consist of the Blue Spy and you, Sgt. Hawk. Battle through several different backyard environments with the ultimate goal of destroying the Tan Army. Good luck, soldier!",https://www.pricecharting.com/game/gameboy-advance/army-men-turf-wars
gameboy-advance,Around the World in 80 Days,7/5/2004,Everyone,Disney,Unkown,Action & Adventure,6.7799E+11,11429,"Action game based on the Jules Verne movie starring Jackie Chan as Passepartout, the valet of Phileas Fogg who joins Fogg on his bet to go around the world in 80 days. Around the World in 80 Days for Game Boy Advance puts players in the Jackie Chan role, having to beat the tar out of thugs from all parts of the word in this side-scrolling beat-em-up. The action spans worldwide locations such as Paris, Turkey, India, China...even San Francisco. Around the World in 80 Days was developed by Saffire for Hip Games. Climb buildings, bounce off canopies, spring from ledge to ledge, cross narrow wires, travel by train, elephant, ship, airplane, and balloon, and face off against all kinds of opponents from the movie and beyond.",https://www.pricecharting.com/game/gameboy-advance/around-the-world-in-80-days
gameboy-advance,Arthur and the Invisibles,1/9/2007,Everyone,Atari,Unkown,Action & Adventure,7.42725E+11,1984,"Directly inspired by world famous film director and writer Luc Besson's upcoming animated film of the same name, the Arthur and the Minimoys game will follow the film's storyline and feature eye-popping graphics and technical innovations.",https://www.pricecharting.com/game/gameboy-advance/arthur-and-the-invisibles
