Console,Title,Release_Date,ESRB,Publisher,Developer,Genre,UPC,PC_ID,Summary,URL
gameboy-advance,Shrek Superslam,10/25/2005,Everyone 10+,Activision,Unkown,Fighting,047875809895,2534,"Activision knows gamers loved the movie SHREK and that gamers love melee battle games, so they've combined the two into SHREK SUPERSLAM for the GBA. Now players can battle their way through the story mode or fight a friend using the GBA link. SHREK SUPERSLAM features 10 characters from SHREK and SHREK II, including Shrek, Donkey, Fiona, Puss-n-Boots, the Gingerbread man, and more. They will battle it out in 10 different levels, each of which is inspired by scenes from the movies and is fully interactive. Each character has a basic light and heavy attack plus throws and a unique slam attack that they can use once they build up enough power by hitting their foes. Each character also has specific strengths and weaknesses that will impact how players battle with them. Players can also grab weapons that appear on each level and use them against their opponents. There are a number of different modes in the game, including the single-player story mode, tutorial mode, multiplayer mode, and the mega challenge mode. Story mode allows players to unlock more characters, stages, and alternate outfits for the fighters. Challenge mode presents players with a challenge a race, a number of items to collect, etc that they must accomplish before their opponents do. More special characters and unlockable items are available for players who complete each minigame. Fighting gamers will find that SHREK SUPERSLAM keeps all of the wicked humor and one-liners from the movies while creating an entertaining, addicting melee game.",https://www.pricecharting.com/game/gameboy-advance/shrek-superslam
gameboy-advance,Shrek Swamp Kart Speedway,3/19/2002,Everyone,TDK,Unkown,Racing,7.3907E+11,2535,"Shrek has always loved his home-sweet-swamp, but ever since Lord Farquaad declared his land the Kingdom's Grand Dumping Ground there has been more junk around than any ogre needs. Now Shrek finds himself amidst the kingdom's not-so-grand trash and must find a way to get rid of it. So, Shrek has put the trash to work for him, creating the greatest racing vehicle of all time-Shrek's lean, mean ogre kart. Now Shrek and the fairy tale troops are ready to compete in the zaniest roadster challenge ever. Only one question remains: Who will be victorious in the race for the Dragon's treasure?",https://www.pricecharting.com/game/gameboy-advance/shrek-swamp-kart-speedway
gameboy-advance,Shrek the Third,5/15/2007,Everyone,Activision,Unkown,Action & Adventure,047875819511,11236,"In Shrek the Third, players journey as Shrek and his friends to save Far, Far Away in a twisted fairytale adventure from the movie and beyond. Assuming the roles of Shrek, Puss-in-Boots and newcomer Artie, players journey beyond Far Far Away with the help of Merlin's magic wand. Shrek the Third for the Game Boy Advance closely follows the storyline of the movie as the characters complete great quests that end with them saving Far Far Away from the villainous Prince Charming.",https://www.pricecharting.com/game/gameboy-advance/shrek-the-third
gameboy-advance,Sigma Star Saga,8/16/2005,Everyone 10+,Namco,WayForward,RPG,7.22675E+11,2536,"When a double-agent's allegiance begins to waver, the galaxy finds itself in a precarious position. Humanity is struggling to survive against the Krill onslaught. Ian Recker, a decorated pilot, goes undercover to investigate the Krill's secrets, but finds himself trapped in a moral dilemma. The first RPG on Game Boy Advance to combine a deep storyline and well-developed characters with a space-shooter battle engine. Customizable weapons including over 15,000 Gun Data combinations. Branching storyline with four ending and 20+ hours of gameplay.",https://www.pricecharting.com/game/gameboy-advance/sigma-star-saga
gameboy-advance,Silent Scope,9/4/2002,Teen,Konami,Unkown,FPS,083717500261,2537,"Silent Scope for the Game Boy Advance marks the first time the popular arcade shooter has appeared on any hand-held console since its 1999 arcade debut. With an easy learning curve, the game features exclusive Game Boy Advance content, as well as additional Training and Challenge modes. Up to four players can play in Multiplayer mode.",https://www.pricecharting.com/game/gameboy-advance/silent-scope
gameboy-advance,SimCity 2000,11/13/2003,Everyone,Electronic Arts,Unkown,Simulation,8.02068E+11,2538,"SimCity 2000 comes to you in this PC-to-Game Boy? Advance system conversion. Take on the role as mayor and call the shots for the entire city. Attract potential citizens by keeping up on the housing, industries, mass transportation, and commerce. Natural disasters and even an alien invasion might occur to set you back. However if you can conquer all of these problems, you just might be able to turn a small town into a thriving metropolis!",https://www.pricecharting.com/game/gameboy-advance/simcity-2000
gameboy-advance,Sitting Ducks,6/29/2004,Everyone,Hip Interactive,Unkown,Action & Adventure,6.7799E+11,2540,"Welcome to the whimsical world of Sitting Ducks, where life is good, food's a plenty, and alligators are lurking in neighboring Swampwood. One bird stands out amongst the flock: Bill. He is a quirky, smaller than average duck with a big imagination and a secret fun loving side. Along with his alligator friend Aldo, Bill embarks on 20 different missions in this whimsical action game. Play as Bill the Duck and Aldo the Alligator from the TV series and explore colorful and detailed levels.",https://www.pricecharting.com/game/gameboy-advance/sitting-ducks
gameboy-advance,Sky Dancers,10/31/2005,Everyone,Unkown,Unkown,Action & Adventure,6.50009E+11,2541,"Sky Dancers is a game made for girls based on the Sky Dancers line of toys. Young adventurers can fly off on an exciting journey with Angelica, Camille and Jade! Queen Skyla has chosen the best dancers from her High Hope Dance Academy to defend the Wingdom from the evil Sky Clone and his wicked servants and henchmen. Sky Clone has spirited away the Queen so he can take over the Wingdom, and the Sky Dancers must use their magical feathers and new special skills to save the day. The game features collectible in-game Sky Dancers costumes and hair accessories that may be traded via the Game Link cable, five unique levels of play, and three mini games: Angelica's Perfect Aim, Jade's Sky Slalom, and Camille's Treasure Hunt.",https://www.pricecharting.com/game/gameboy-advance/sky-dancers
gameboy-advance,Smashing Drive,11/3/2004,Everyone,Namco,Raylight Studios,Racing,7.22675E+11,2542,"Some sharp driving will go far in this yellow cab race. Driving to your destination, you'll need to meet the first checkpoint quickly to get the extra time for the second half of the course. Using ramps and going airborne allows you to snatch glide; turbo-boost and other power-ups frowned upon by real-life traffic-enforcement authorities. Instead of taking on a computer opponent, you can battle another player in Head-to-Head mode via the Game Boy Advance Game Link Cable. The fast frame rate really gives you a sense of speed in the game. You need to make snap decisions about which corner to take and if you want to avoid that oncoming car or drive right through it.",https://www.pricecharting.com/game/gameboy-advance/smashing-drive
gameboy-advance,Smuggler's Run,9/25/2002,Everyone,Destination Software,Unkown,Racing,8.02068E+11,2543,"Drive, evade and explore anywhere across 3 vast levels - Rocky Mountain forest, desert and icy tundra. As a member of a gang of international smugglers, it's your job to evade the U.S. Border Patrol, CIA and cutthroat rivals to deliver illegal cargo. It'll take complete mastery of your off-road vehicle to make it across unforgiving terrain and stay one step ahead...and make the drop.",https://www.pricecharting.com/game/gameboy-advance/smuggler's-run
gameboy-advance,Snood,9/28/2001,Everyone,Unkown,Unkown,Puzzle,8.02068E+11,2544,"We have arrived at Snoodville and the action is all go, go, go! Classic Snood turned sideways is a massive issue as all the snoods fall to the floor. Once they meet up with three of their own color, all the action starts to happen. Clear the board of all the snoods in time limit and other play modes. No more snoods available !! What do we do now? We fire a grappling hook to hook the snoods and pull them back to snood central! Then fire them to where we want them to be to make them fall from the board. Circular snood will also get you in a spin! Fire the snoods up to the highest levels, but watch out -- there are no straight sides to bounce off! You are in a circular tube and the snoods will bounce and fly everywhere if your angles are wrong. Just when you think you have the game beaten the whole world rotates and leaves you fighting to stay in the game!",https://www.pricecharting.com/game/gameboy-advance/snood
gameboy-advance,Snood 2 On Vacation,10/28/2005,Everyone,Unkown,Unkown,Puzzle,8.02068E+11,11714,"We have arrived at Snoodville and the action is all go, go, go! Classic Snood turned sideways is a massive issue as all the snoods fall to the floor. Once they meet up with three of their own color, all the action starts to happen. Clear the board of all the snoods in time limit and other play modes. No more snoods available !! What do we do now? We fire a grappling hook to hook the snoods and pull them back to snood central! Then fire them to where we want them to be to make them fall from the board. Circular snood will also get you in a spin! Fire the snoods up to the highest levels, but watch out -- there are no straight sides to bounce off! You are in a circular tube and the snoods will bounce and fly everywhere if your angles are wrong. Just when you think you have the game beaten the whole world rotates and leaves you fighting to stay in the game!",https://www.pricecharting.com/game/gameboy-advance/snood-2-on-vacation
gameboy-advance,Soccer Kid,9/30/2002,Everyone,Telegames,Unkown,Soccer,8.34815E+11,14302,"A million miles away in outer space, far above the planet Earth, an alien pirate is scanning the area for a trophy of great importance to add to its enormous collection. Beep beep beep goes the scanner as it locates the World Cup, the most prestigious soccer award on the planet, shining brightly in the sun. Suddenly, a blanket of darkness falls over the stadium as the pirate spaceship materializes. The crowd becomes numb as the World Cup disappears from view. Seconds later, as the spaceship flees to outer space.... Bang! the spaceship collides with an asteroid. The World Cup shatters into five pieces which fall to Earth, each chunk landing on a different part of the world.",https://www.pricecharting.com/game/gameboy-advance/soccer-kid
gameboy-advance,Soccer Mania,8/1/2002,Everyone,Lego,Unkown,Soccer,014633145236,2545,"Experience the ultimate celebration of past and future in Sonic Mania, an all-new 2D Sonic adventure running at a crisp 60FPS with stunning HD retro-style graphics. Multiple playable characters give you the ability to go explosively fast as Sonic, soar as Tails, or power through tough obstacles with Knuckles brute strength. You can re-live the Sonic of the past with an exciting new twist on classic zones while fighting against new bosses and Dr. Eggmans evil robot army. Go head-to-head with players in Competition Mode or play in Co-Op Mode with a friend. Sonic Mania is developed by Christian Whitehead, Headcannon, and PagodaWest Games in collaboration with Sonic Team. Welcome to Sonic Mania!",https://www.pricecharting.com/game/gameboy-advance/soccer-mania
gameboy-advance,Sonic Advance,2/3/2002,Everyone,THQ,Dimps,Action & Adventure,010086600025,2546,"SONIC IS BACK TO SAVE THE WORLD! The evil Dr. Eggman is at it again, with a brand new scheme to trip up Sonic and his pals. Maneuver your way through obstacles, puzzles and traps to collect the Chao Emeralds and defeat the vile Dr. Eggman before it’s too late!",https://www.pricecharting.com/game/gameboy-advance/sonic-advance
gameboy-advance,Sonic Advance & Sonic Pinball Party,11/1/2005,Everyone,Sega,Unkown,Action & Adventure,010086600339,11019,"2 Games in 1: Sonic Advance & Sonic Battle, called Double Pack: Sonic Battle & Sonic Advance in Japan, is a compilation of two Sonic games for the Game Boy Advance. It contains the games Sonic Advance and Sonic Battle. There are no extras, just a menu that lets you select the two games. On emulation websites the European ROM is being labelled as 2 In 1 Sonic Pack Vol 3.",https://www.pricecharting.com/game/gameboy-advance/sonic-advance-&-sonic-pinball-party
gameboy-advance,Sonic Advance 2,3/9/2003,Everyone,Sega,Dimps,Action & Adventure,7.85138E+11,2547,"Dr. Eggman is up to his old tricks! Join Sonic, Tails, Knuckles, and their new friend, Cream the Rabbit, as they take off on a blazingly fast quest to thwart Dr. Eggman's nefarious scheme. Dash through space age metal labyrinths and other new locales as Sonic, Tails, Knuckles and Cream",https://www.pricecharting.com/game/gameboy-advance/sonic-advance-2
gameboy-advance,Sonic Advance 3,6/7/2004,Everyone,THQ,Dimps,Platformer,7.85138E+11,2548,JOIN THE QUEST TO DEFEAT THE EVIL DR. EGGMAN! *Team up with any one of 5 different characters *Pull off different combinations of attack moves *Experience changes in game play depending on a player's partner selection *Multiplayer option allows up to 4 players (Game Link),https://www.pricecharting.com/game/gameboy-advance/sonic-advance-3
gameboy-advance,Sonic Battle,1/5/2004,Everyone,THQ,Unkown,Fighting,7.85138E+11,2549,"Sonic and pals are gearing up for some brawling action! Fight as one of nine characters including Sonic, Tails and Shadow! Knock 'em dead with special attacks and team-based assaults. Create and train fighting partner for 2-on-2 battles. Duke it out with your friends in 4 player battles.",https://www.pricecharting.com/game/gameboy-advance/sonic-battle
gameboy-advance,Sonic Pinball Party,6/1/2003,Everyone,Unkown,Unkown,Arcade,010086600131,18489,"It's time to get the party started right with Sonic Pinball Party for the Game Boy Advance. Sonic The Hedgehog returns to the Game Boy Advance, with the ultimate handheld pinball experience, delivering fresh pinball boards filled with SONICTEAM characters and a huge assortment of multiplayer party games. With SONICTEAM characters from Sonic The Hedgehog, Samba de Amigo and Nights, Sonic Pinball Party challenges players to shoot, tilt, and flip their way through a slew of pinball boards, lightning fast mini-games and party games that promise to give gamers the pinball fix they've been craving!",https://www.pricecharting.com/game/gameboy-advance/sonic-pinball-party
gameboy-advance,Sonic The Hedgehog Genesis,11/14/2006,Everyone,Unkown,Unkown,Action & Adventure,010086600407,11022,"Now, for the first time on GBA! The original Sonic The Hedgehog that busted the speed barrier wide open on the SEGA Genesis is coming to the Game Boy Advance with exciting new features! For the first time, you'll be able to save your high scores and progress as you rocket through the seven gravity-defying stages that started it all. Outrun Dr. Robotnik and his badniks in Original Mode, race through the famous loop-de-loops even faster with Sonic's trademark Spin Dash in Anniversary Mode which celebrates Sonic's 15th birthday.",https://www.pricecharting.com/game/gameboy-advance/sonic-the-hedgehog-genesis
gameboy-advance,Space Channel 5 Ulalas Cosmic Attack,6/17/2003,Everyone,THQ,Unkown,Music,7.85138E+11,2551,"When the Morolians invade, ace reporter Ulala scoops the story for Space Channel 5. The hip-hopping aliens zap citizens into a hypnotic dance trance, but beat girl Ulala is their ultimate match. She busts out her grooviest attacks to free the captives and make headlines. Get down with Sega's supernova star as she struts through the space station in style.",https://www.pricecharting.com/game/gameboy-advance/space-channel-5-ulalas-cosmic-attack
gameboy-advance,Space Invaders,3/1/2002,Everyone,Activision,Unkown,Arcade,047875803138,2552,Space Invaders is a game in which the player controls a laser cannon by moving it horizontally across the bottom of the screen and firing at descending aliens.,https://www.pricecharting.com/game/gameboy-advance/space-invaders
gameboy-advance,Spiderman,4/1/2002,Everyone,Activision,Unkown,Action & Adventure,047875803312,2553,"Spider-Man, the classic comic book co-created by Stan Lee, is now a major motion picture. This conversion of the movie to the video game world takes the major storyline, characters and artwork of the Spider-Man movie and adds a lengthy backstory and new characters.",https://www.pricecharting.com/game/gameboy-advance/spiderman
gameboy-advance,Spiderman 2,6/29/2004,Everyone,Activision,Unkown,Action & Adventure,047875805910,2554,"Orphaned at a young age, Peter Parker, a good-hearted teenager, lives in Queens, New York with his aunt and uncle. On a school trip to a research institute, Peter Parker is bitten by a genetically engineered spider and soon discovers that suddenly his vision is perfect and his previously scrawny body has become muscular-he now has incredible strength, and his hands mysteriously adhere like glue to everything. Assume the role of Peter Parker and his alter-ego Spider-man to defend the city from the clutches of evil. Master all-new combat moves and dizzying airborne acrobatics. Move through stunning scenes from the movie as you explore enormous city environments with newfound maneuverability. Battle the world's toughest villains, including Shocker, Vulture, and the Green Goblin.",https://www.pricecharting.com/game/gameboy-advance/spiderman-2
gameboy-advance,Spiderman 3,5/4/2007,Everyone 10+,Activision,Unkown,Action & Adventure,047875819979,2555,"The game's plot expands on the film by including additional characters and elements from the Spider-Man comics and the Marvel Universe. Depending on the platform, different villains from the comics are featured, but all versions of the game feature the film's main villains: Venom, New Goblin, and Sandman.",https://www.pricecharting.com/game/gameboy-advance/spiderman-3
gameboy-advance,Spiderman Battle for New York,11/14/2006,Everyone 10+,Activision,Unkown,Action & Adventure,047875816558,11233,"Spider-Man: Battle for New York allows players to take on the role of Spider-Man, and one of his famed nemeses, Green Goblin. For the first time in a handheld Spider-Man game players can personalize their experiences by choosing what abilities and powers to upgrade and when, such as Spider-Man’s web maneuvers or Green Goblin’s fire attacks.",https://www.pricecharting.com/game/gameboy-advance/spiderman-battle-for-new-york
gameboy-advance,Spiderman Double Pack,8/1/2005,Everyone,Unkown,Unkown,Action & Adventure,047875811812,10406,2 In 1 Game Pack: Spider-Man + Spider-Man 2 is a compilation of Spider-Man games developed by Digital Eclipse and published by Activision for Game Boy Advance.,https://www.pricecharting.com/game/gameboy-advance/spiderman-double-pack
gameboy-advance,Spiderman Mysterio's Menace,9/19/2001,Everyone,Activision,Unkown,Action & Adventure,047875802018,2556,"Set in New York, Spider-Man: Mysterio's Menace enables players to assume the role of Spider-Man as they take on super-villain Mysterio and his illusory tricks for control of Manhattan. Spider-Man must fight a slew of Mysterio's sinister conspirators and gadgetry to get to the bottom of their plot and free New York from Mysterio's mind-warping grip.",https://www.pricecharting.com/game/gameboy-advance/spiderman-mysterio's-menace
gameboy-advance,Spiderman Mysterio's Menace / X-2 Wolverines Revenge,8/1/2005,Everyone,Unkown,Unkown,Action & Adventure,047875811836,11229,"2 in 1 Game Pack: Spider-Man: Mysterio's Menace / X2: Wolverine's Revenge is a game compilation that features both Spider-Man: Mysterio's Menace and X2: Wolverine's Revenge, developed by Vicarious Visions and published by Activision and released in August 2005.",https://www.pricecharting.com/game/gameboy-advance/spiderman-mysterio's-menace-x-2-wolverines-revenge
gameboy-advance,Spirit Stallion of the Cimarron Search for Homeland,5/1/2002,Everyone,Unkown,Unkown,Action & Adventure,7.85138E+11,11641,"As a wild and rambunctious mustang stallion named Spirit, help your scattered herd get home safely.",https://www.pricecharting.com/game/gameboy-advance/spirit-stallion-of-the-cimarron-search-for-homeland
gameboy-advance,Spirits and Spells,11/2/2003,Everyone,dreamcatcher,Unkown,RPG,6.25904E+11,2557,"Released in Europe as Castleween by Wanadoo, in Japan as Mahou no Pumpkin by MTO, Spirits & Spells is an inch of horror, a dash of surprise and a whiff of fantasy: Halloween's magic formula. It's Halloween night and Alicia's and Greg's friends have all had a terrible curse put on them: their souls have been stolen! The two will have to cross over into the kingdom of the dead if they want to find their friends and free them from this dreadful spell. Features 20 monsters (skeletons, vampires, witches, devils and others) which you will have to avoid and/or fight, collect life and invincibility bonuses as well as precious gems across 12 levels.",https://www.pricecharting.com/game/gameboy-advance/spirits-and-spells
gameboy-advance,Splinter Cell,4/27/2003,Teen,Ubisoft,Unkown,Action & Adventure,008888140399,2558,"Side-scrolling stealth action game, based on the Xbox hit. The game puts you in control of Sam Fisher, an ex-CIA, ex-Navy SEAL who's called into service at the request of the National Security Agency. The NSA has commissioned a new sub-agency called Third Echelon to gather intelligence in the colder, more cruel geopolitical landscape of 2004. Third Echelon has the latitude to deploy Splinter Cells -- such as Sam -- highly trained operatives who are granted the Fifth Freedom to do whatever it takes to protect the country. The downside is that if Sam's ever caught doing dirt, the US government will disavow any knowledge of his existence. Links up with the GameCube version.",https://www.pricecharting.com/game/gameboy-advance/splinter-cell
gameboy-advance,Splinter Cell Pandora Tomorrow,3/24/2004,Teen,Ubisoft,Unkown,Action & Adventure,008888141600,2559,"The gameplay of Pandora Tomorrow is largely unchanged from the original Splinter Cell. The game features some moderate graphical improvements, as well as minor gameplay changes such as the fact that health kits are no longer an inventory item, and the addition of a laser sight to Sam's pistol that allows the player to know exactly where the rounds will strike, even when moving around. Also, Sam can now open doors while carrying a body, shoot while hanging upside down, SWAT turn past doorways unnoticed, and perform a half split jump.",https://www.pricecharting.com/game/gameboy-advance/splinter-cell-pandora-tomorrow
gameboy-advance,SpongeBob's Atlantis SquarePantis,9/1/2007,Everyone,THQ,Unkown,Action & Adventure,7.85138E+11,10251,"SpongeBob's Atlantis SquarePantis will follow SpongeBob and the rest of the Bikini Gang as they leave Bikini Bottom and journey to the legendary city of Atlantis. Players will discover the treasures of Atlantis, while experiencing new game mechanics and multiplayer features.",https://www.pricecharting.com/game/gameboy-advance/spongebob's-atlantis-squarepantis
gameboy-advance,SpongeBob SquarePants and Fairly OddParents,9/1/2006,Everyone,THQ,Unkown,Action & Adventure,7.85138E+11,11650,The SpongeBob SquarePants Double Pack gives you a double-shot of silly underwater adventures starring the popular NickToons character. This two-pack includes the Revenge of the Flying Dutchman and SuperSponge.,https://www.pricecharting.com/game/gameboy-advance/spongebob-squarepants-and-fairly-oddparents
gameboy-advance,SpongeBob SquarePants Battle for Bikini Bottom,10/31/2003,Everyone,THQ,Unkown,Action & Adventure,7.85138E+11,2561,"In an effort to cause the kind of global mayhem he has always dreamed of, the evil Plankton has set in motion his most diabolical plot ever to take over the world. The fate of Bikini Bottom has been put in the hands (or small tentacles) of three unsuspecting heroes. Put your platform skills to the test as SpongeBob, Patrick, or Sandy Cheeks, with an array of insane new maneuvers and power-ups at your disposal. Explore a huge 3D world, encounter familiar friends, and finally put an end to Plankton's evil scheme.",https://www.pricecharting.com/game/gameboy-advance/spongebob-squarepants-battle-for-bikini-bottom
gameboy-advance,SpongeBob SquarePants Creature from Krusty Krab,10/16/2006,Everyone,THQ,WayForward,Action & Adventure,7.85138E+11,2562,"SpongeBob SquarePants: Creature from the Krusty Krab is an Action game, developed by WayForward and published by THQ, which was released in 2006.",https://www.pricecharting.com/game/gameboy-advance/spongebob-squarepants-creature-from-krusty-krab
gameboy-advance,SpongeBob SquarePants Lights Camera Pants,10/21/2005,Everyone,THQ,Unkown,Action & Adventure,7.85138E+11,2563,"SpongeBob SquarePants: Lights!, Camera!, Pants!, the city of Bikini Bottom is producing a show called The Adventures of Mermaid Man & Barnacle Boy in which the titular SpongeBob wishes to play as the starring role. SpongeBob must compete with the other characters in the series – including Patrick Star, Sandy Cheeks, Squidward Tentacles, Mr. Krabs and Sheldon J. Plankton – in order to impress the talent scouts and land the lead role of the villain.",https://www.pricecharting.com/game/gameboy-advance/spongebob-squarepants-lights-camera-pants
