Console,Title,Release_Date,ESRB,Publisher,Developer,Genre,UPC,PC_ID,Summary,URL
gameboy-advance,Dragon Ball Z The Legacy of Goku I & II,12/8/2005,Everyone,Unkown,Unkown,Fighting,7.42725E+11,11592,"Embark on an incredible journey to protect the Universe from evil. Guide the fate of the mightiest warrior known - GOKU - from the Saiyan Saga to the Cell Games. Use combat strategies to defeat arch enemies, including Frieza, the Androids and Perfect Cell!",https://www.pricecharting.com/game/gameboy-advance/dragon-ball-z-the-legacy-of-goku-i-&-ii
gameboy-advance,Dragon Tales Dragon Adventures,11/1/2001,Everyone,NewKidCo,Unkown,Action & Adventure,6.61204E+11,2142,"Wish on Dragon Scale and get whisked away to Dragon Land. Then choose your adventure from five different fun-filled stories. While searching for Dragon Berry cupcakes, gems, and musical Notes you will travel to magical places like Puzzlewood in the Crystal Caves!",https://www.pricecharting.com/game/gameboy-advance/dragon-tales-dragon-adventures
gameboy-advance,Drake and Josh,3/15/2007,Everyone,THQ,Unkown,Action & Adventure,7.85138E+11,10403,"The Drake & Josh videogame follows the lives of two very different step-brothers and their crazy adventures with school, girls and their crafty sister Megan. In the game, players interact with all of their favorite characters from the show, including Drake and Josh, in a variety of modes featuring problem solving, stealth, strategy and action-style gameplay.",https://www.pricecharting.com/game/gameboy-advance/drake-and-josh
gameboy-advance,Drill Dozer,2/6/2006,Everyone,Nintendo,Unkown,Action & Adventure,045496736897,2143,"In the platformer Drill Dozer, you can take the roll of Jill, the daughter of a crime boss who is set on revenge. When a rival gang steals away her family's heirloom, Jill gives chase in her Drill Dozer, an upgradeable piece of power armor equipped with a large drill. This piece of equipment will help you navigate through six different areas, where you will encounter varied enemies and bosses.",https://www.pricecharting.com/game/gameboy-advance/drill-dozer
gameboy-advance,Driven,11/28/2001,Everyone,Bam Entertainment,Crawfish Interactive,Racing,6.82384E+11,11432,"Inspired by Sylvester Stallone's hit movie 'DRIVEN', race on 8 stunning tracks including California's Angel's Bay and Paris' Champs-Ã‰lysees.

Challenge your racing skills in multiple racing styles - Arcade, Story and Multiplayer modes (2 player split screen).
Choose from 12 characters, each with distinct personalities and driving styles.
Experience high impact crash sequences and even race through busy city streets.
Exclusive team mode - race as lead driver and blocker.
Featuring the vocal talents of Sylvester Stallone, Greg Proops and Eric Myers.",https://www.pricecharting.com/game/gameboy-advance/driven
gameboy-advance,Driver 2 Advance,10/22/2002,Teen,Infogrames,Unkown,Racing,7.22243E+11,2144,"Get behind the wheel and back on the streets as Tanner, the world's fastest undercover driver. An international gang war has erupted, and you are caught in the crossfire. Experience all new urban chaos as you dodge U.S. and Brazilian gangsters.",https://www.pricecharting.com/game/gameboy-advance/driver-2-advance
gameboy-advance,Driver 3,10/1/2005,Teen,Unkown,Unkown,Racing,7.42725E+11,11591,"The Wheelman returns in his most dangerous adventure yet--an interactive driving epic on par with the most intense Hollywood action blockbusters. Undertake a wide variety of high-speed vehicle-based missions and go deeper undercover than ever before. The game features over 70 playable vehicles, including cars, bikes, artics, and busses, and eight different weapons, ranging from handguns and machine guns to grenade launchers. Driver 3 provides gamers with all new gameplay possibilities, replayability, and a whole new driving experience.",https://www.pricecharting.com/game/gameboy-advance/driver-3
gameboy-advance,Drome Racers,6/19/2003,Everyone,THQ,Unkown,Racing,7.85138E+11,2145,"Tensions are high as you await the first stage of the Drome Championship.You've trained for the intensity of Multi-Challenge Racing; each race a seamless set of stages, mixing tracks from realistically stunning City, Mountain, and Canyon environments.",https://www.pricecharting.com/game/gameboy-advance/drome-racers
gameboy-advance,Dual Blades,10/7/2002,Mature,Metro3D,Unkown,Action & Adventure,6.50002E+11,2146,"It is 150 B.C. amidst the Hun Empire. You must possess the power to slay your enemies and execute insane combos. The fearsome Alperen has harnessed incredible energy by merging his soul and the immortal sword to create the legendary weapon of Dual Blades. Survive battle after battle and face the ultimate test to topple Alperen, gain the sword and become immortal!",https://www.pricecharting.com/game/gameboy-advance/dual-blades
gameboy-advance,Duel Masters Kaijudo Showdown,11/16/2004,Everyone,Atari,Unkown,Fighting,7.42725E+11,11585,"Get ready for intense tournament battles in this card-battling game that features characters from the Duel Masters animated series. Kaijudo Showdown challenges you to build a fighting deck from 300 Duel Masters cards, which you'll need defeat your enemies. As you duel various opponents, you'll improve your skills and solve the mystery of the missing artifacts. With a Game Boy Advance link cable, you can battle against or trade cards with your friend.",https://www.pricecharting.com/game/gameboy-advance/duel-masters-kaijudo-showdown
gameboy-advance,Duel Masters Sempai Legends,6/1/2004,Everyone,Atari,Unkown,RPG,7.42725E+11,2147,"Based on the Duel Masters Trading Card game in Japan, Duel Masters: Sempai Legends puts you in the role of a kohai (junior duelist). Your grandfather, a great Sempai (senior duelist), gives you a valuable Duel Masters card, which is soon stolen by a mysterious man. Now it is up to you to travel to nearby towns and villages in hopes of regaining the stolen property. Along the way, you'll face many opponents in Duel Masters tournaments with the hope of one day becoming a professional Duelist.",https://www.pricecharting.com/game/gameboy-advance/duel-masters-sempai-legends
gameboy-advance,Duel Masters Shadow of The Code,10/18/2005,Everyone,Atari,Unkown,Fighting,7.42725E+11,11589,"Duel Masters: Shadow of the Code is a Strategy game, developed by Amble and published by Atlus, which was released in 2005.",https://www.pricecharting.com/game/gameboy-advance/duel-masters-shadow-of-the-code
gameboy-advance,Duke Nukem Advance,8/12/2002,Teen,Unkown,Unkown,Action & Adventure,7.10425E+11,2148,"Alien scientists have taken control of the top-secret Area 51 military base, and are plotting to overthrow Earth! But not if Duke can stop them. Armed with alien-busting weapons, his kick-butt attitude, and using the aliens' own transporters, Duke takes the battle to four unique locations around the world. Oh, and rescues a few babes along the way.",https://www.pricecharting.com/game/gameboy-advance/duke-nukem-advance
gameboy-advance,Dungeons & Dragons Eye of the Beholder,10/30/2002,Everyone,Infogrames,Unkown,RPG,7.22243E+11,2149,"A new evil has fallen upon the peaceful city of Waterdeep. You have been called upon to uncover its source and destroy it. As you embark on an epic odyssey with a band of fearless adventurers, you'll need to prepare yourself for confrontation with countless enemies and obstacles.",https://www.pricecharting.com/game/gameboy-advance/dungeons-&-dragons-eye-of-the-beholder
gameboy-advance,Dynasty Warriors Advance,8/29/2005,Everyone 10+,Nintendo,Koei,Action & Adventure,045496735715,10739,"Your kingdom is under attack! Powerful rivals surround you, waiting for the chance to strike, and only you have the power to save the day. With nowhere to hide, you unleash an awesome Musou attack and watch your enemies fall! Savor the victory, because even greater challenges lie before you!",https://www.pricecharting.com/game/gameboy-advance/dynasty-warriors-advance
gameboy-advance,Earthworm Jim,6/10/2001,Everyone,Majesco,Game Titan,Action & Adventure,096427012535,2150,"The storyline involves many colorful characters. Jim (voiced by TenNapel) was at first an ordinary earthworm who did very earthworm-like things such as flee from crows and eat dirt. One day, in the space above Earth, the evil Psy-Crow had cornered a rebel spaceship pilot who had stolen an Ultra-high-tech-indestructible-super-space-cyber-suit built by Professor Monkey-for-a-Head. The suit had been commissioned by the evil Queen Pulsating, Bloated, Festering, Sweaty, Pus-filled, Malformed, Slug-for-a-Butt so that she could further conquer the galaxy. In the ensuing space fight, the suit was dropped to Earth, and fell on Jim. By a stroke of luck, Jim managed to land within the collar of the suit, and it ended up mutating him into the large and intelligent (at least by earthworm standards) superhero he is today.",https://www.pricecharting.com/game/gameboy-advance/earthworm-jim
gameboy-advance,Earthworm Jim 2,5/31/2002,Everyone,Majesco,SuperEmpire Interactive,Action & Adventure,096427012719,7319,"Earthworm Jim returns in a madcap chase across the galaxy saving cows and thwarting lawyers all the way. Whip, run, jump and Snot swing your way through 10 of the most outrageous and untraditional levels anywhere. Returning favorite characters include; Princess What's-Her-Name, Psy-Crow, Peter Puppy, Bob the Goldfish, and several new villains as well!",https://www.pricecharting.com/game/gameboy-advance/earthworm-jim-2
gameboy-advance,Ecks vs. Sever,11/27/2001,Teen,BAM,Unkown,Action & Adventure,6.82384E+11,2151,"At the beginning of the game, players choose which character, Ecks or Sever, they wish to control. Both characters' plots intertwine and are given different level designs for each of their missions.",https://www.pricecharting.com/game/gameboy-advance/ecks-vs-sever
gameboy-advance,Ed Edd N Eddy Jawbreakers,9/15/2002,Everyone,BAM,Unkown,Action & Adventure,6.82384E+11,2152,"Ed, Edd n Eddy: Jawbreakers is a video game released on March 25, 2003, by Cartoon Network Interactive, based on the popular television cartoon Ed, Edd n Eddy for the Game Boy Advance. It was developed by Climax Group and BAM! Entertainment. The game mirrors Ed, Edd (Double Dee), and Eddy's television quest to make money to buy jawbreakers.",https://www.pricecharting.com/game/gameboy-advance/ed-edd-n-eddy-jawbreakers
gameboy-advance,Ed Edd N Eddy Mis-Edventures,11/3/2005,Everyone,Midway,Unkown,Action & Adventure,031719191574,2153,"Midway brings back all the craziness of the Cartoon Network's ED, EDD, N EDDY with ED, EDD, N EDDY: MIS-EDVENTURES for the Game Boy Advance. Centering around three kids with the same name, MIS-EDVENTURES follows Ed, Edd, and Eddy through yet another of their zany adventures. Gamers will control all three kids throughout the game, switching between them at any point. Each of the three had their own special abilities, and players will need to master each character to get through the puzzle-filled levels. Ed is the powerhouse of the team, able to pick up large objects and move them out of the way. Edd can operate machinery and can make use of different items. Eddy has stealth abilities and is the only character who can use stink bombs to get enemies out of the way. Each of the three also has an unique team-up move that involved all three characters working together. The levels contain the typical insanity often found in the cartoon. On one level, for example, players have to try to sell a number of snow cones from their snow cone stand; however, to get the business going, players have to steal ice from other characters. There are several different scams to complete, each of which involves Ed, Edd, and Eddy making use of whatever they can find or steal. Gamers who love ED, EDD, N EDDY will love stepping into the characters' shoes with ED EDD N EDDY: MIS-EDVENTURES.",https://www.pricecharting.com/game/gameboy-advance/ed-edd-n-eddy-mis-edventures
gameboy-advance,Egg Mania,9/16/2002,Everyone,Kemco,Unkown,Action & Adventure,7.41648E+11,2154,"As an Eggo builder, its your job to sort and organise air-dropped puzzle pieces to assemble platforms that gradually form a tower above a steadily rising ocean. Because water quickly seeps up through incomplete floors it is vital that you build complete platforms to slow the rising water. The goal is to reach the balloon that hovers high in the sky, however, to complicate matters, tower-tumbling and thieving enemies prowl the depths and soar the skies, looking for ways to drown your spirit - so work quickly!!",https://www.pricecharting.com/game/gameboy-advance/egg-mania
gameboy-advance,Elf Bowling 1 & 2,11/28/2005,Teen,Ignition,Unkown,Sports,8.93384E+11,11830,"Elf Bowling 1 Strap on your best pair of bowling skates and polish up your shiny Christmas ball. It's time to save Christmas from those greedy little union elves. Help Santa show those elves what the true meaning of 'strike' is! Elf Bowling 2 - 'Elves in Paradise' The snickering elves are back with Santa, but there is a new twist as Santa's ne'er-do-well brother, Dingle Kringle, joins Santa and the Elves on a cruise ship headed for an island adventure. Compete in a crazy shuffleboard tournament, with the Elves serving as pucks and providing their own special, colorful commentary.",https://www.pricecharting.com/game/gameboy-advance/elf-bowling-1-&-2
gameboy-advance,Elf the Movie,11/4/2004,Everyone,Crave,Unkown,Action & Adventure,6.50009E+11,2155,"You might say that Buddy stands out a bit at the North Pole. Sure, he was raised by elves after stowing away in Santa's bag, but after 30 years, he just doesn't seem to fit in any more – literally. Santa suggests that Buddy journey to New York and find his real father, but when he arrives, hilarity ensues as Buddy learns his way in the Big City. Make your way through 10 different stages inspired by the movie or compete in three different mini-games.",https://www.pricecharting.com/game/gameboy-advance/elf-the-movie
gameboy-advance,Enchanted Once Upon Andalasia,11/1/2007,Everyone,Disney,Unkown,Action & Adventure,7.12725E+11,11500,"Become enchanted with the official game based on the Disney animated movie. This fairy tale story follows the beautiful princess Giselle as she is banished by an evil queen from her magical, musical animated land and finds herself in the gritty reality of the streets of modern-day Manhattan. Shocked by this strange new environment that doesn't operate on a happily ever after basis, Giselle is now adrift in a chaotic world badly in need of enchantment!",https://www.pricecharting.com/game/gameboy-advance/enchanted-once-upon-andalasia
gameboy-advance,Eon Ticket,11/1/2003,Not Applicable,Nintendo,Nintendo,Other,Unkown,527267,Unkown,https://www.pricecharting.com/game/gameboy-advance/eon-ticket
gameboy-advance,Eragon,11/14/2006,Everyone 10+,Vivendi Universal,Unkown,Action & Adventure,020626724340,11109,"Based on the best-selling novel and feature film, this epic fantasy-adventure centers on a young farm boy named Eragon whose destiny is revealed with the help of a dragon. Eragon, now a Dragon Rider, is swept into a world of magic and power, discovering that he alone has the power to save -- or destroy -- an Empire. Offering a completely different gaming experience from the console game, Eragon for the GameBoy Advance delves further into the rich story of the Eragon universe in a story-driven, turn-based RPG with nine playable characters and fully customizable character skills, along with weapon forging and potion crafting.",https://www.pricecharting.com/game/gameboy-advance/eragon
gameboy-advance,ESPN Final Round Golf 2002,7/1/2001,Everyone,Konami,Unkown,Golf,083717500049,2183,"Golf action has moved from the greens to the portable convenience of the Game Boy® Advance. Choose from 14 golfers, 5 courses and a variety of club. You will experience realistic weather conditions such as wind, rain and sunshine on the fairway. Tee off against up to 3 other players using the Game Boy Advance Game Link cable.",https://www.pricecharting.com/game/gameboy-advance/espn-final-round-golf-2002
gameboy-advance,ESPN Great Outdoor Games Bass 2002,3/1/2002,Everyone,Majesco,Unkown,Sports,083717500087,2158,"With crystal-clear graphics, sound effects as clear as an Alpine stream and excellent play control, ESPN Great Outdoor Games: Bass Fishing is sure to knock your warders off! In Free Fishing Mode, drop a line into any of the 30 ponds and lakes that dot the tranquil landscape. Cast your skills against the world's top anglers in Tournament mode. In this mode, you'll race to see who can land the five biggest fish of a given variety, including bluegills and many types of bass. After picking from 15 unique lures, a power meter indicates the strength of your cast. You can reel in or play out line. Successful anglers will continually monitor the water depth and temperature and the time of day. The atmospheric soundtrack includes chirping birds, softly lapping water and cheery banjo plucking.",https://www.pricecharting.com/game/gameboy-advance/espn-great-outdoor-games-bass-2002
gameboy-advance,ESPN International Winter Sports 2002,1/1/2002,Everyone,Konami,Unkown,Sports,083717500155,2159,"As for the Winter Olympics rapidly approach, ESPN the Games invites gamers to experience all the thrills, chills and spills of cold-air competition with the only multi-event winter sports game available on any platform - ESPN International Winter Sports 2002. Boasting fast-paced events such as Downhill Alpine Skiing, Freestyle Mogul Skiing, Speed Skating, Bobsledding and more, ESPN International Winter Sports 2002 is fully-loaded. Cut through the gates at death-defying speeds in the slalom or bust some big air ski jumping as ESPN International Winter Sports 2002 provides the ultimate gaming experience for the most timid snowbunnies to adventurous hot dogs alike.",https://www.pricecharting.com/game/gameboy-advance/espn-international-winter-sports-2002
gameboy-advance,ESPN Winter X-Games: Snowboarding,1/1/2002,Everyone,Konami,Unkown,Extreme Sports,083717500117,13845,"The most authentic snowboarding game returns! Winter X Games Snowboarding 2002 features more arcade fun and snowboarding action. Win a gold medal in on of four authentic Winter X Games events, or go anywhere in the free ride mode, where you can pull off big kickers and twisted rails to your heart's content.",https://www.pricecharting.com/game/gameboy-advance/espn-winter-x-games-snowboarding
gameboy-advance,ESPN X Games Skateboarding,9/12/2001,Everyone,GameBoy,Unkown,Extreme Sports,083717500032,2160,"he X Games could be considered the Olympics for Generation X, and now one of the premier events skateboarding has made its way to the Game Boy Advance with ESPN X GAMES SKATEBOARDING. Choose from eight pro skaters Bob Burnquist, Carlos DeAndrade, Chad Fernandez, Kerry Getz, Rick McCrank, Colin McKay, Chris Senn, and Lincoln Ueda and 64 licensed decks as you get ready to shred on the streets, sidewalks, handrails, and more. There will be three cities to skate in San Francisco, New York, and Los Angeles each with location-specific elements and landmarks. The game consists of nine levels, broken into three categories: X Games competition, street skating, and fantasy. The 12 big-name bands including Linkin Park, Voodoo Glow Skulls, and New Found Glory will provide the adrenaline-pumping tunes to keep the action fast and furious. Get ready to ollie, grind, and kickflip your way to victory with ESPN X GAMES SKATEBOARDING.",https://www.pricecharting.com/game/gameboy-advance/espn-x-games-skateboarding
gameboy-advance,ET the Extra Terrestrial,12/14/2001,Everyone,New Kid,Unkown,Action & Adventure,6.61204E+11,2161,"Re-live the best moments of the classic movie, E.T. The Extra-Terrestrial in this GBA title. Search for the parts to the transmitter and put it together so that E.T. can contact his homeworld (aka Phone Home) then evade the police, FBI and scientists to get to the spaceships landing spot. Play as both E.T. and Elliott in fully interactive environments, playing levels based on key scenes in the movie (such as the home contact, bike chase and more).",https://www.pricecharting.com/game/gameboy-advance/et-the-extra-terrestrial
gameboy-advance,EverGirl,10/9/2005,Everyone,THQ,Unkown,Action & Adventure,7.85138E+11,8917,"Based on the tween lifestyle brand, this action / adventure game contains loads of adventures tailored specifically to the player's personality type. The game allows girls to customize their characters so they can play sports, design fashions, produce music or become an entrepreneur.",https://www.pricecharting.com/game/gameboy-advance/evergirl
gameboy-advance,Excitebike E-Reader,1/1/2002,Rating Pending,Unkown,Unkown,Action & Adventure,045496732035,18650,Unkown,https://www.pricecharting.com/game/gameboy-advance/excitebike-e-reader
gameboy-advance,Extreme Ghostbusters,12/30/2002,Everyone,Dreamcatcher,Unkown,Action & Adventure,6.25904E+11,2211,"In an attempt to takeover the world, the newly liberated and powerful ectoplasmic forces, led by the half-human, half-demon Count Mercharior, have kidnapped two key members of the Extreme Ghostbusters team. Without wasting a second, Eduardo and Kylie jump into the famous Ecto-1 ambulance and race off to the rescue... Play as Eduardo and Kylie as you uncover the clues to the kidnapping, confront the evil Count Mercharior and return your teammates, Roland and Garrett, to safety! Features: The entire universe and characters of the well-known animated series in a a brand-new adventure! Twelve exciting platform levels through four gigantic worlds! Four exhilarating car races across the busy streets of New York City!",https://www.pricecharting.com/game/gameboy-advance/extreme-ghostbusters
gameboy-advance,F-14 Tomcat,9/2/2001,Everyone,Majesco,Virtucraft,Simulation,096427012504,2166,"Armed with an array of Air-Interceptor Missiles, and a 20mm Vulcan cannon, you fly a series of blue-water operations while engaging in head-to-head combat with MIG 29s, MIG 24s, and enemy targets. Numerous cockpit computer displays help you splash each enemy bogey with extreme precision, and when you've completed your sortie, attempt a heart-pounding first-person carrier landing that will challenge even the most experienced naval aviator. Fly alone or link up for some gut-wrenching head-to-head four player competition as you battle for supremacy of the skies.",https://www.pricecharting.com/game/gameboy-advance/f-14-tomcat
gameboy-advance,F-24 Stealth Fighter,2/13/2007,Everyone 10+,Majesco,Unkown,Simulation,096427014775,11348,"Intelligence reports indicate that Iran is looking to conduct offensive air operations within the No Fly Zone. As an F24 fighter pilot you must eliminate the enemy, rescue international leaders and secure diplomacy in the Middle East.",https://www.pricecharting.com/game/gameboy-advance/f-24-stealth-fighter
gameboy-advance,F-Zero GP Legend,9/20/2004,Everyone,Nintendo,Unkown,Racing,045496733988,2197,"The year is A.D. 2201, and you are about to enter the world of ultra high speed F-Zero Grand Prix races, which take place on circuit tracks all over the universe. Take control of eight different characters as you race through an action packed story that spans multiple planets!",https://www.pricecharting.com/game/gameboy-advance/f-zero-gp-legend
gameboy-advance,F-Zero Maximum Velocity,6/12/2001,Everyone,Nintendo,Nd Cube,Racing,045496731403,2198,"All galactic speed limits are about to be broken! F-Zero® Maximum Velocity has arrived, and the future of racing has never looked so sweet. Brand-new vehicles and Game Boy Advance original tracks await, so whether you're a Super NES® veteran or a race rookies, you'll need some practice laps. And even if you do master the Grand Prix circuit, you'll still have to beat your friends to the finish line. That's right, race fans--with the Game Boy Advance Game Link® cable you can take on up to three rival racers, so put the pedal to the metal and get busy boosting, bumping and jumping your way to intergalactic glory!",https://www.pricecharting.com/game/gameboy-advance/f-zero-maximum-velocity
gameboy-advance,F1 2002,1/7/2003,Everyone,Destination Software,Unkown,Racing,8.02068E+11,2165,"Handheld racer, features a smooth framerate for great controllability and a strong sense of speed. Cars are based on physical model settings: tires, aero, gearbox, and brakes. The developers endowed the machines with accurate characteristics for gears, max speed, rpm max, and engine curves. Thanks to the official FIA license, players will find 17 real circuits, 11 teams and 22 official drivers. The game also features race incidents (crashes, withdrawals, engine breakdowns, real-time broken records), an audio engine simulating up to 4 engines at the same time (gears, power, Doppler effects), and two difficulty settings. Players can modify car assistance and other pilots' skills and speed and choose from four game modes: Race, Season 2002, Custom Championship and Multiplayer.",https://www.pricecharting.com/game/gameboy-advance/f1-2002
gameboy-advance,Fairly Odd Parents: Breakin' Da Rules,10/1/2003,Everyone,THQ,Helixe,Action & Adventure,7.85138E+11,2167,"Juandissimo Magnifico tricks Timmy into wishing the book destroyed so that Cosmo and Wanda will get in trouble for it. It also notably features an appearance by Vicky and Tootie's mother (at Timmy's age, as the level featuring her is set in the past), named Nicky. Here, she is shown behaving a lot like Tootie, and Timmy initially mistakes her for Tootie when he first sees her, although the in-game graphics depict her as resembling a young Vicky.",https://www.pricecharting.com/game/gameboy-advance/fairly-odd-parents-breakin'-da-rules
