Console,Title,Release_Date,ESRB,Publisher,Developer,Genre,UPC,PC_ID,Summary,URL
super-nintendo,Math Blaster Episode 1,10/1/1994,Unkown,Unkown,Unkown,Other,051581322005,6999,"A follow-up to the original Math Blaster! games, Math Blaster: In Search of Spot is an educational title with arcade elements designed to help students learn maths while having fun.",https://www.pricecharting.com/game/super-nintendo/math-blaster-episode-1
super-nintendo,Maui Mallard in Cold Shadow,11/1/1996,Unkown,Nintendo,Unkown,Action & Adventure,045496330415,13041,"When he morphs into a ninja, you better duck! Play as Maui. Play as the Ninja. Play as Maui. Play as the Ninja. Try not to get dizzy. Find the missing Shabuhm Shabuhm idol before your island paradise goes kaboom! 40 hours of intense gameplay. So pack plenty of attitude. And your bug gun. Come beak to beak with MudDrakes, Rotting Pirates, Duck Zombies, Amazon Warriors. And a bunch of fowl-tempered hangers-on. Laugh in the face of danger from the top of a volcano, the bottom of the sea, the Realm of the Dead, and Ninja Training Grounds. Then get the heck out! Live every level like it's your last - 'cuz it may be!",https://www.pricecharting.com/game/super-nintendo/maui-mallard-in-cold-shadow
super-nintendo,Mecarobot Golf,9/1/1993,Unkown,TOHO Video Games,Unkown,Golf,091521100072,13042,"In Mecarobot Golf, a mechanical golfer by the name of Eagle was banned from competing in professional human tournaments when it was determined that his mechanical brain that can determine the right angles was an unfair advantage. Instead, the engineers that built Eagle have built him his very own course and the player has taken up the challenge against the mechanical golfer.",https://www.pricecharting.com/game/super-nintendo/mecarobot-golf
super-nintendo,MechWarrior,5/1/1993,Unkown,Activision,Unkown,Action & Adventure,047875540033,7381,"In 3017, when Herras Ragen was 12, his father Colonel Joseph T. Ragen, a soldier in the House Davion army, was working to infiltrate and destroy a renegade mercenary cartel called the Dark Wing Lance. However, he was discovered, and the Dark Wing took their revenge: somehow, they had learned the location of the Ragen family's residence. Under cover of night they attacked, killing everyone. Only young Herras, who was at a friend's house at the time of the massacre, survived. Unbeknownst to him, the Dark Wing made an agreement that after the strike, they would separate for ten years and maintain an absolute code of secrecy before regrouping again to continue their nefarious operations. Now, in 3027, that time is up. Herras, who has become a young man, has waited the last decade for his chance to take revenge. As a mercenary MechWarrior operating from the planet Galatea, with a light 'Mech in the hangar and 50.000 C-Bills in the bank, he will accept any mission that will lead him closer to finding the murderers of his family.",https://www.pricecharting.com/game/super-nintendo/mechwarrior
super-nintendo,MechWarrior 3050,10/1/1995,Unkown,Unkown,Unkown,Action & Adventure,047875540248,10396,MechWarrior 3050 is the second Battletech based game from Activision for the Super NES. This time around its viewed in an isometric view as opposed to the first person view of the previous game. The game also features a unique 2 player mode where one player controls the bottom half of the mech to navigate it around the map while the second player controls the upper torso which moves independently.,https://www.pricecharting.com/game/super-nintendo/mechwarrior-3050
super-nintendo,Mega Man 7,9/1/1995,Kids to Adults,Capcom,Capcom,Action & Adventure,013388130313,7000,"Dr. Wily's crusade to rule the world ends abruptly at the hands of Mega Man, so what's a villain to do? Create a diversion and break out of prison! Mega Man has his hands full as 4 gigantic machines exit Dr. Wily's lab to ravage the city, but... who is behind this new plot as Wily sits behind bars?",https://www.pricecharting.com/game/super-nintendo/mega-man-7
super-nintendo,Mega Man Soccer,4/1/1994,Everyone,Capcom,Capcom,Soccer,013388130177,7001,Dr. Wily will stop at nothing to control the world and who would have thought his next move would be to attack the world's most popular sport? Dr. Light is ready and he's preparing Mega Man for a new type of battle.,https://www.pricecharting.com/game/super-nintendo/mega-man-soccer
super-nintendo,Mega Man X,1/1/1994,Not Applicable,Capcom,Capcom,Action & Adventure,013388130153,7002,"Near the end of his life, Dr. Light succeeds in creating the first of a new series of robots which will change the world. Able to think and make decisions, this new robot holds great danger as well as great possibilities. Fearful of the possible consequences of unleashing his creation on the world, Dr. Light decides to seal him in a capsule and test his systems until they are totally reliable. The future will have to decide his fate...",https://www.pricecharting.com/game/super-nintendo/mega-man-x
super-nintendo,Mega Man X2,1/1/1995,Kids to Adults,Capcom,Capcom,Action & Adventure,013388130290,7003,"Just when Mega Man X thought he had brought down all the X-Hunters, several months later an uprising moves from within an abandoned factory. While 8 all-new X-Hunters occupy Mega Man X, a triple threat plots to resurrect a secret weapon that is all too familiar!",https://www.pricecharting.com/game/super-nintendo/mega-man-x2
super-nintendo,Mega Man X3,1/1/1996,Everyone,Capcom,Capcom,Action & Adventure,013388130320,7004,Mega Man X and his trusty partner Zero have a new force to reckon with. Who or what has caused a riot of Mavericks to break out in the experimental utopia known as Doppler Town?,https://www.pricecharting.com/game/super-nintendo/mega-man-x3
super-nintendo,Metal Combat,9/1/1993,Everyone,Nintendo,Intelligent Systems,Light Gun,045496830243,7005,"Following the events of Battle Clash, the Battle Game Chiefs had been defeated. But the world did not return to peace and instead new Chiefs and new machines rose up to rule the world. Like before, the Chiefs use giant robots known as Standing Tanks (STs). Seeing the world in trouble, the hero pilots who had defeated the Battle Chiefs decide to once again enter the Battle Game using an improved version of their ST, the Falcon. The truth behind the Battle Game will take the Falcon deep into space...",https://www.pricecharting.com/game/super-nintendo/metal-combat
super-nintendo,Metal Marines,12/1/1993,Unkown,Unkown,Unkown,Action & Adventure,7.22674E+11,12017,"Metal Marines is an isometric strategy game. Controlling one side of a conflict, the player must wage a campaign across several islands to defeat Zorgeuf and his lieutenants. The player controls logistics of the base to ensure that there are the necessary assets to wage war. On each map, the player places three underground command bases, if all of these are destroyed the battle is lost. The player must manage the resources of their money to construct new buildings or upgrade existing facilities on the map. Different buildings include Energy Plants, Factories, Economic Centers, Radar systems, Anti-Aircraft missiles, fake buildings and fake HQ bases, mine fields, gun pods, missile launchers, metal marine hangers and even ICBMs. At any time, the player may order an attack and choose which assets to fire at the opponent. Missiles, Metal Marines carriers and ICBMs all use different levels of fuel. Metal Marines once deployed in an area will automatically fire rifles at nearby targets or engage even closer targets in melee attacks. Gunpods, while stationary, will also fire on nearby enemies. Metal Marines are largely autonomous but can be manually controlled to a minor degree (directional) by the player.",https://www.pricecharting.com/game/super-nintendo/metal-marines
super-nintendo,Metal Morph,12/1/1994,Unkown,FCI,Unkown,Action & Adventure,022909400088,7006,"Metal Morph is a side-scrolling platformer. As the Metal Morph, you can jump, duck and shoot, as well as transform into an invulnerable liquid blob of metal. While as a blob, you can also travel through pipes to get to areas you couldn't normally. Power ups such as triple shots and homing missiles make battle easier for you.",https://www.pricecharting.com/game/super-nintendo/metal-morph
super-nintendo,Metal Warriors,4/1/1995,Mature,Konami,Unkown,Action & Adventure,083717150220,7007,"It's the year 2102 and the Dark Axis Forces - an intergalactic army threatening to enslave the Earth - are knocking at your door with a plasma-blast greeting. You've got a three ton laser-sword wielding, energy-cannon firing, jet-propelled suit of robotic armor at your disposal.",https://www.pricecharting.com/game/super-nintendo/metal-warriors
super-nintendo,Michael Andretti's Indy Car Challenge,9/1/1994,Everyone,Unkown,Unkown,Racing,7.15504E+11,7008,"Indy Car Challenge lets the player get behind the car of some of the fastest race cars on Earth. The player gets to race on 16 different Indy tracks across the U.S., with some tracks also in Canada and Australia. The view of the game is set behind the back of the car and there are three different camera angles during the replay of races along with a manual camera that lets the player rotate around the car at 360 degrees.",https://www.pricecharting.com/game/super-nintendo/michael-andretti's-indy-car-challenge
super-nintendo,Michael Jordan Chaos in the Windy City,11/1/1994,Everyone,Electronic Arts,Unkown,Basketball,014633070484,14271,This is no pick up game... It's a twisted adventure created by vengeful mad scientist Dr. Max Cranium! He has kidnapped an entire basketball team. And they're under lock and key in every corner of his dark and dangerous lair beneath the street of Chicago. Control Michael Jordan's every move as he takes on the evil Dr. Max Cranium to rescue his teammates.,https://www.pricecharting.com/game/super-nintendo/michael-jordan-chaos-in-the-windy-city
super-nintendo,Mickey's Ultimate Challenge,2/1/1994,Everyone,Unkown,Unkown,Action & Adventure,087855000799,7010,"Mickey's Ultimate Challenge is a puzzle game in which the player chooses either Mickey or Minnie to play with. They'll find five characters from the Disney's universe in the kingdom, and will be prompted to help them in several tasks.",https://www.pricecharting.com/game/super-nintendo/mickey's-ultimate-challenge
super-nintendo,Mickey Mania,10/1/1994,Everyone,Unkown,Unkown,Action & Adventure,7.35009E+11,7009,"Mickey Mouse gets a chance to go down memory lane and walk through the timeless adventures he has lived. Mickey Mania is a platformer where all the levels are based on Mickey's most famous cartoons. The levels range about 75 years, starting off with Steamboat Willie and going all the way to The Prince and the Pauper.",https://www.pricecharting.com/game/super-nintendo/mickey-mania
super-nintendo,Micro Machines,12/1/1994,Everyone,Unkown,Unkown,Racing,020295030223,7011,"If you're bored of racing Formula 1 cars, rally cars or MotoGP bikes in their natural habitats, the Micro Machines series could be for you. It involves racing miniatures representing particular vehicle types across a particular terrain found around the house. The Sports Cars race on the desktop, 4x4s in the sandpit, Formula 1 cars on a snooker table, and so on.",https://www.pricecharting.com/game/super-nintendo/micro-machines
super-nintendo,Might and Magic III Isles of Terra,1/1/1995,Teen,FCI Inc,Unkown,Action & Adventure,020295030162,7012,"The third installment of the roleplaying series, with a multi-faceted plot full of twists and turns. Ease of use was central to the gameplay and interface, and the plot included piles of new twists and turns.",https://www.pricecharting.com/game/super-nintendo/might-and-magic-iii-isles-of-terra
super-nintendo,Mighty Morphin Power Rangers,11/23/1994,Unkown,Bandai,Natsume,Action & Adventure,045557088408,7013,"Mighty Morphin Power Rangers is the title of five different video games based on the first season of the television series of the same name, one for each of the following game platforms: Sega Genesis/Mega Drive, Super Nintendo Entertainment System, Game Boy, Game Gear, and Sega CD. The Nintendo versions of the game were released by Bandai, while the Sega versions were published by Sega themselves. The Green Ranger is only playable on the Genesis and Game Gear versions of the game. The Super NES version of Mighty Morphin Power Rangers is a side-scrolling action game composed of seven stages, with two different gameplay styles.",https://www.pricecharting.com/game/super-nintendo/mighty-morphin-power-rangers
super-nintendo,Mighty Morphin Power Rangers The Movie,6/1/1995,Unkown,Unkown,Unkown,Action & Adventure,045557088415,7015,"The Power Rangers stripped of the Mighty Morphin Powers and forced to flee the earth? Rita Repsula and Lord Zedd over whelmed by an evil far greater than their combined nastiness? The Command Centre totally obliterated and Zordon on the brink of death? The fate of the world in the slimey hands of Ivan Ooze, the most sinister monster the universe has ever seen? Could this be a bad dream? Don't count on it. It all happens in the Morphinominal Mighty Morphin Power Rangers the Movie! And now, you can battle Ivan Ooze, the vilest villain in Nintendo history and a whole host of his mean and ugly minions in this hyper action, seven levels, no holds barred brawl featuring the eye popping graphics and ear pounding sounds of the Super NES. So, morph into action and lead the Power Rangers on to their greatest victory.",https://www.pricecharting.com/game/super-nintendo/mighty-morphin-power-rangers-the-movie
super-nintendo,Miracle Piano,,Everyone,Unkown,Unkown,Music,Unkown,16136,"The Miracle Piano Teaching System is an educational program from Software Toolworks that teaches users how to play the piano through a keyboard peripheral which was included in the package. Users simply followed the on-screen instructions to learn how to play the piano, tapping keys indicated by the screen. Eventually, the user would learn to recognize the various notes and learn the musical notation, and could progress to playing the music without the use of indicators.",https://www.pricecharting.com/game/super-nintendo/miracle-piano
super-nintendo,MLBPA Baseball,3/1/1994,Unkown,Electronic Arts,Unkown,Baseball,014633071764,15648,"Never before has a baseball game been created that captures the details of the sport like MLBPA Baseball. Realistic run-downs, accurate cut-off plays, the double switch, multiple defensive alignments, snap throws, even bad hops and booted balls. Throw in every player from Alamar to Zeile and you've got the only baseball game worth playing for the Super NES.",https://www.pricecharting.com/game/super-nintendo/mlbpa-baseball
super-nintendo,Mohawk and Headphone Jack,8/1/1996,Unkown,Interplay,Unkown,Action & Adventure,7.85138E+11,7016,"Go With The Flow! Mohawk & Headphone Jack are funky, flexible life forms who can morf and completely change their shape. Normally laid back, these gelatinous guys are forced into a battle to protect their party lifestyle from the militant forces of General Headslot. Grab some tunes and get busy! - Sprout wings, burn rubber, stick to walls, transform into a sea creature and more! You can even reconstruct yourself if you explode. - Pick up tons of cool music CDs and cruise through ooze tubz to find the hidden vortexes throughout the game. - Use the special zoom-out map feature to keep from getting lost in 14 huge levels! - Forget up and down! Leap onto a surface and make it a floor. But better hang on - the whole level rotates around you!",https://www.pricecharting.com/game/super-nintendo/mohawk-and-headphone-jack
super-nintendo,Monopoly,9/1/1992,Everyone,Parker Brothers,Unkown,Other,073000040970,7388,"Buy Park Place! Sell Marvin Gardens! Build Hotels! Collect Rents! Go to Jail! With advanced 16-bit technology, you‚Äôre in the middle of the wheeling and dealing action on an animated board that makes the classic real estate game come to life! Action-filled vignettes show the scene as you buy, sell build and collect from your opponents. The system handles all the accounting for fast action and quick deals. Play a random game or speed things up with a pre-set scenario. Whether you play alone or challenge human or computer players, your goal is to acquire the most wealth--and drive your opponents to financial ruin!",https://www.pricecharting.com/game/super-nintendo/monopoly
super-nintendo,Mortal Kombat,9/13/1993,Mature,Acclaim Entertainment,Sculptured Software,Fighting,021481601074,7017,"The #1 arcade hit is here: from Sub-Zero, Rayden and the rest of the Kombat Warriors to the grueling endurance and intense mirror matches! Execute bone-shattering combos and ferocious finishing moves! Defeat the half human dragon Goro, and destroy the shape-changing Shang Tsung to become the Supreme Mortal Kombat Warrior!",https://www.pricecharting.com/game/super-nintendo/mortal-kombat
super-nintendo,Mortal Kombat 3,10/1/1995,Mature,Midway,Sculptured Software,Fighting,031719199433,13745,"Get ready for the fight of your life! 14 Selectable Fighters - including 8 new characters, 2 new bosses and 1 fighter hidden within the game! Watch out for this dude! 32 Megs - the most ever for a Mortal Kombat game! 12 new 3D rendered moving backgrounds to keep you jumping. Secret portals that allow you to smash up and down into different backgrounds for the ultimate bi-level battlefield! More fatalities, animalities and babalities! Intense, live-action, fully-digitized fight sequences for the most realistic action you've ever encountered!",https://www.pricecharting.com/game/super-nintendo/mortal-kombat-3
super-nintendo,Mortal Kombat II,1/1/1994,Mature,Acclaim Entertainment,Sculptured Software,Fighting,021481620051,7018,"Following his failure to defeat Liu Kang in the first Mortal Kombat game, the evil sorcerer Shang Tsung begs his master, Shao Kahn, to spare his life. He tells Shao Kahn that the invitation for Mortal Kombat cannot be turned down, and if they hold it in Outworld, the Earthrealm warriors must attend. Kahn agrees to this plan, and even restores Tsung's youth. He then extends the invitation to Raiden, who gathers his warriors and takes them into Outworld. The new tournament is much more dangerous, as Shao Kahn has the home field advantage, and an Outworld victory will allow him to subdue Earthrealm.",https://www.pricecharting.com/game/super-nintendo/mortal-kombat-ii
super-nintendo,Mr. Do!,12/1/1996,Unkown,Unkown,Unkown,Action & Adventure,7.85138E+11,7020,"You control Mr. Do has he tries to harvest all of the cherries on the screen. However, there are numerous bad guys out to get him! Mr. Do can defend himself from the badguys in two ways: first he can push the apples located throughout the playfield on top of the enemies and crush them. Secondly, Mr. Do is armed with a power ball. This can be thrown to destroy an enemy. Mr. Do has only one power ball, though, so he will need to wait for it to return to him before it can be used again. From time to time an alpha monster will appear on the screen bearing one of the letters in EXTRA. If you use the power ball to destroy an alpha monster you earn that letter; when you've earned the complete word EXTRA you receive an extra life. When you successfully collect all of the cherries, you will move on to the next, more difficult level.",https://www.pricecharting.com/game/super-nintendo/mr-do
super-nintendo,Mr. Nutz,8/1/1994,Unkown,Unkown,Unkown,Action & Adventure,020295030148,13043,"You are the cool squirrel of the title, and you must defeat the evil Yeti before he freezes the entire world. Your quest will make you explore many areas such as a forest, a witch's cottage, a volcano, the clouds, a circus...",https://www.pricecharting.com/game/super-nintendo/mr-nutz
super-nintendo,Ms. Pac-Man,9/1/1996,Kids to Adults,Namco,Unkown,Arcade,031719199617,7021,"In 1982, a sequel to the incredibly popular Pac-Man was introduced in the form of his girlfriend, Ms. Pac-Man. This sequel continued on the eat the dots/avoid the ghosts gameplay of the original game, but added new features to keep the title fresh. Like her boyfriend, Ms. Pac-Man attempts to clear four various and challenging mazes filled with dots and ever-moving bouncing fruit while avoiding Inky, Blinky, Pinky and Sue, each with their own personalities and tactics. One touch from any of these ghosts means a loss of life for Ms. Pac-Man.",https://www.pricecharting.com/game/super-nintendo/ms-pac-man
super-nintendo,Musya Classic Japanese Tale of Horror,12/1/1992,Teen,Unkown,Unkown,Action & Adventure,092826922024,14035,"Plunge into a world of ancient Japanese horror. As Imoto, a spear wielding Samurai, it's your duty to descend deep into the Abyss to save the world from the horrors of the Evil One. Fight through hordes of hideous monsters to save Shizuka, the keeper of the Talisman that seals the Evil One in his prison. It's up to you to save her. Use your fierce spear spin attack to weave a web of destruction. Call on magical farces to blast your way through the legions leprous beasts.",https://www.pricecharting.com/game/super-nintendo/musya-classic-japanese-tale-of-horror
super-nintendo,Natsume Championship Wrestling,6/1/1994,Unkown,Natsume,Natsume,Wrestling,7.19593E+11,20084,"Over 50 different moves: Cobra Twist, Pyle Driver, Backdrop, Brain Buster, DDT, Kitchen Sink, Rally Art, Avalance Hold, Guillotine Drop, Shoulder Through, Sleeper Hold, Kneedrop, Reverse Shrimp Hold, Powerbomb and much more...",https://www.pricecharting.com/game/super-nintendo/natsume-championship-wrestling
super-nintendo,NBA All-Star Challenge,12/1/1992,Unkown,LJN,Unkown,Basketball,023582087030,14997,"NBA All-Star Challenge offers one-on-one basketball featuring NBA players from the 1991-1992 season. Five different playing modes are available: a single one-on-one match, a free throw competition, a 3 point shootout, a H.O.R.S.E. competition and a one-on-one tournament. You can choose from 27 players (one from every NBA team), including Michael Jordan, Larry Bird, Patrick Ewing, Karl Malone and David Robinson. Each mode can also be played by two players.",https://www.pricecharting.com/game/super-nintendo/nba-all-star-challenge
super-nintendo,NBA Give 'n Go,11/1/1995,Unkown,Unkown,Unkown,Basketball,083717150244,13044,"NBA Give 'n Go is a port of the arcade version basketball game. The game is different from usual basketball games of the era because it is played in a vertical view. Most basketball games previously had a side scrolling or isometric view. Building upon this technique, the game features large player sprites and graphics. The game features the NBA roster from 1995 complete with player ratings. Gameplay consists of true 5 on 5 basketball but in a more arcade like style with alley-oops and high flying dunks. The audio includes action oriented commentary, in the style of NBA Jam.",https://www.pricecharting.com/game/super-nintendo/nba-give-'n-go
super-nintendo,NBA Hang Time,11/1/1996,Everyone,Unkown,Unkown,Basketball,031719199631,12553,"NBA Hang Time is a 2-on-2 arcade basketball action game following in the footsteps of NBA Jam. All NBA teams, each featuring 4 players to choose from, are included along with fast paced, over-the-top basketball, disregarding the normal rules of the game but including fouls and out of bounds. You can also create your own player, with a collection of body parts and clothing to choose from.",https://www.pricecharting.com/game/super-nintendo/nba-hang-time
super-nintendo,NBA Jam,3/1/1994,Everyone,Unkown,Unkown,Basketball,021481601104,7022,"NBA Jam, which featured 2-on-2 basketball, was one of the first real playable basketball arcade games, and was also one of the first sports games to feature NBA-licensed teams and players, and their real digitized likenesses.",https://www.pricecharting.com/game/super-nintendo/nba-jam
super-nintendo,NBA Jam Tournament Edition,2/23/1995,Kids to Adults,Acclaim,Unkown,Basketball,021481680789,7023,"NBA JAM Tournament Edition brings you more senses-shattering slam dunking excitement than ever! More than twice as many NBA superstars, more than double the secret characters, Hot Spots, Super Jam Power-Ups, battery back-up and - OH MY - nine all-new rim-rattling slam dunks plus all the original jams! NBA JAM Tournament Edition... it's on FIRE!",https://www.pricecharting.com/game/super-nintendo/nba-jam-tournament-edition
super-nintendo,NBA Live 95,10/1/1994,Everyone,Electronic Arts,Unkown,Basketball,014633073829,13823,"All new, fast & awesome! NBA LIVE '95 is totally new EA SPORTS brings you the BEST basketball game to date. It combines fast action-packed gameplay with all the strategy and realism of 5-on-5 basketball.",https://www.pricecharting.com/game/super-nintendo/nba-live-95
super-nintendo,NBA Live 96,10/1/1995,Unkown,Electronic Arts,Unkown,Basketball,014633075847,14335,Back to Back Champion! NBA Live 96 returns for another CHAMPIONSHIP season. NEW player animations and REALISTIC strategy make it the COOLEST hoops game ever created on the Super NES.,https://www.pricecharting.com/game/super-nintendo/nba-live-96
super-nintendo,NBA Live 97,12/1/1996,Kids to Adults,Electronic Arts,Unkown,Basketball,014633077315,14056,"NBA Live is where players come to play. Real NBA competition. Real NBA skills and strategy. Real players. Like you. Right? 2-on-2 and 3-on-3 halfcourt games. 3-Point and Shoot Out competitions. 1996-97 updated rosters including rookies and over 300 NBA stars. All 29 NBA teams plus 2 NBA All-Star and 4 custom teams. Complete stats and ratings for all players, plus stat tracking during season play. Exhibition, Playoffs, and full 1996-97 NBA Schedule Season play.",https://www.pricecharting.com/game/super-nintendo/nba-live-97
