Console,Title,Release_Date,ESRB,Publisher,Developer,Genre,UPC,PC_ID,Summary,URL
super-nintendo,Star Trek Starfleet Academy,5/1/1994,Everyone,THQ,Unkown,Action & Adventure,040421820191,7105,"It's high tension at the Klingon Neutral Zone. You must get past the blockage and deliver supplies to the Federation colonists on a planet claimed by the Klingon Empire. One false move could lead to war and even millions of causalities. Your reputation at the Academy is at stake.
Star Trek¬Æ: Starfleet Academy‚Ñ¢, The Bridge Simulator has over 15 simulated missions in the final frontier. Command five different starships, from science vessels to Constitution-class heavy cruisers on a variety of missions ranging from scientific research...to diplomacy...to battle. Star Trek¬Æ: Starfleet Academy‚Ñ¢, The Bridge Simulator puts you on the bridge of Starfleet's finest vessels. In the toughest simulations that the Federation can devise.",https://www.pricecharting.com/game/super-nintendo/star-trek-starfleet-academy
super-nintendo,Star Trek the Next Generation,3/1/1994,Teen,BPS,Unkown,Action & Adventure,085004109454,10943,"The Mission: To uncover the mystery of the most powerful device in the galaxy--the Derandomizer. Long considered a mere myth, the Derandomizer returns from the past to threaten the future of the Federation. But, the Federation isn't the only one interested in it. The Romulans have crossed the Neutral Zone... and mysterious alien Chodak fleets are converging towards them. From the Bridge, chart a course to strange new world. There, you and the Star Trek: The Next Generation crew must pass the tests set forth by the Arbitrator, the force which controls the powers of the derandomizer. Captain Picard will offer guidance, but it's your decision who to take on each Away Team mission. Will you need Worf's strength? Or Geordi's special vision? All systems ready, Commander.",https://www.pricecharting.com/game/super-nintendo/star-trek-the-next-generation
super-nintendo,Stargate,2/1/1995,Unkown,Unkown,Unkown,Action & Adventure,021481620075,13068,"Based on the movie of the same name, a mystical circular portal called a Stargate has been uncovered. In attempting to unlock its secrets, its power is unlocked creating a passageway to a different world named Abydos. A special forces team is sent to the new world to investigate but is soon ambushed and its supplies taken including a powerful nuclear bomb.",https://www.pricecharting.com/game/super-nintendo/stargate
super-nintendo,Steel Talons,11/1/1993,Everyone,Unkown,Unkown,Action & Adventure,7.66958E+11,7107,"Steel Talons brought realism-oriented helicopter combat to the arcades, and later to home systems. The action is viewed from behind your helicopter, with the 3D polygon world rotating around you, taking in mountains, rivers and deserts.",https://www.pricecharting.com/game/super-nintendo/steel-talons
super-nintendo,Sterling Sharpe: End 2 End,3/1/1995,Unkown,Unkown,Unkown,Football,032264700228,21631,"End 2 End is a football game with the main attraction of it being that it has the personal endorsement of former Green Bay Packer, Sterling Sharpe. Game modes consist of Exhibition, Playoff and All-Star, however there is no Season mode. The game features 30 different teams modeled after their NFL counterparts except that their nicknames and logos are absent from the game as well as their being no actual NFL players.",https://www.pricecharting.com/game/super-nintendo/sterling-sharpe-end-2-end
super-nintendo,Stone Protectors,11/1/1994,Teen,Vic Tokai,Unkown,Action & Adventure,7.41648E+11,7108,"A kingdom built by crystals in under attack by the Saurians. Their leader, called Zok, wants the kingdom's powerful crystals which is protected by the Queen. Breaking into the castle, all seems lost, but as Zok reaches to take the crystal, it explodes into pieces and they fly away... to earth. All but one of the crystals reaches New York and flies into the hands of a rock band... who are transformed into goblins by the power of the crystals. Now their goal is to bring back the pieces to the kingdom and fight Zok and take his piece.",https://www.pricecharting.com/game/super-nintendo/stone-protectors
super-nintendo,Street Combat,4/1/1993,Unkown,IREM,Unkown,Fighting,7.15664E+11,13069,"KNOCK-OUT ACTION FOR 2 PLAYERS AT ONCE! Your Mission...Seek out and destroy a group of ruthless villains who'll stop at nothing to wipe you off the map. Each brutal renegade is a wizard at martial arts and trick moves. You must battle six deadly foes until you confront your greatest challenge-their master, the diabolical C.J. Punch, leap, somersault and kick your way over skyscraper beams, through the jungle, gritty back alleys, a wrestling ring, the top of a truck, and more. You've never punched-up so much pure action and exciting game play.",https://www.pricecharting.com/game/super-nintendo/street-combat
super-nintendo,Street Fighter Alpha 2,11/1/1996,Teen,Unkown,Unkown,Fighting,045496830625,7452,"DO YOU HAVE WHAT IT TAKES? The bad boys from the Street Fighter series are back for more fisticuffs of fury! Eighteen different combatants, some old and some new, are here to lay claim to the title World's Best. Screamin' moves like Ken's Dragon Punch, Adon's Jaguar Tooth and M. Bison's Somersault Skull Driver will blow you away! Play alone or pummel a friend in two-player simultaneous action. This ain't no cakewalk. This ain't no cakewalk. This is Street Fighter Alpha 2 and it's blazing on your Super NES!",https://www.pricecharting.com/game/super-nintendo/street-fighter-alpha-2
super-nintendo,Street Fighter II,7/1/1992,Teen,Capcom,Capcom,Fighting,013388130054,7453,"GET READY TO RUMBLE! From across the globe comes eight of the wildest fighters the world has ever known. Choose your champion, gather your courage and prepare to battle your opponents in a bare knuckle brawl. Face Ken and his devastating Dragon Punch! Watch the temperature rise as Dhalsim incinerates you with his mystical Yoga Flame! Hear your spine crack as Zangief smashes you to the pavement with his spinning pile driver! Cover your ears as Guile breaks the sound barrier with the awesome power of the Sonic Boom! Annihilate your competition and claim the right to test your skills against the bone-crushing power of the Grand Masters! Can you survive? Can Anyone?",https://www.pricecharting.com/game/super-nintendo/street-fighter-ii
super-nintendo,Street Fighter II Turbo,8/1/1993,Teen,Capcom,Capcom,Fighting,013388130061,7109,"They're back and they're badder than ever! Faster, stronger and with all new moves, twelve of the greatest fighters from across the globe are ready to do battle! Choose your champion and get ready for the big brawl as they try to earn the right to battle M. Bison for the title. And just when you think you've mastered it all, crank it up a notch and go TURBO!",https://www.pricecharting.com/game/super-nintendo/street-fighter-ii-turbo
super-nintendo,Street Hockey 95,11/1/1994,Everyone,GTE,Unkown,Sports,7.94546E+11,13070,"Street Hockey '95 is like ice hockey without ice and in urban environments with no-holds barred rules. Instead of ice skates, roller blades are used as players can pick from nine different skaters and assemble their squad in a series of game modes. There are five modes in all: Fat Point, Rush, Whack, Crammit and Hot Puck, each with their own rules, time-limit and scoring system (ex. Fat Point awards players different points by what kind of shot they scored the goal with).",https://www.pricecharting.com/game/super-nintendo/street-hockey-95
super-nintendo,Street Racer,12/1/1994,Everyone,Ubisoft,Unkown,Racing,008888060000,7110,"Street Racer is a kart racing game similar to Super Mario Kart. Up to four players can play by split-screen. If there are no human opponents, the player can drive against seven computer opponents in three leagues. If the player wins the first league, they can play the second and so on. The game has eight different vehicles with different skills in speed, haste or resistance. There are also some power-ups on the tracks such as bombs, nitro fuel, and health packs.",https://www.pricecharting.com/game/super-nintendo/street-racer
super-nintendo,Strike Gunner STG,8/1/1992,Unkown,Unkown,Unkown,Action & Adventure,097933300017,7111,"In the far future A.D. 2008 aliens have invaded the Earth and launched a full-scale war that threatens humankind. Earth's scientists have built two of the ultimate weapons, the Strike Gunner, piloted by Mark McKenzie and Jane Sinclair to repel the invasion and destroy the alien armies",https://www.pricecharting.com/game/super-nintendo/strike-gunner-stg
super-nintendo,Stunt Race FX,7/1/1994,Everyone,Unkown,Unkown,Racing,045496830267,7454,"The game features four modes of play: Speed Trax is basically an arcade mode where the player has to qualify for each upcoming race by reaching checkpoints while collecting items to restore his damage- and boost-bar. It is divided into a Novice-, Expert-, and Master class, with each class featuring four unique tracks. In Stunt Trax the player has to complete courses filled with obstacles within a certain time limit while trying to collect as many stars as possible. Battle Trax is a two player mode taking place on special tracks without any CPU-controlled opponents. Finally, Test Run let's the player practice all tracks that have been unlocked.",https://www.pricecharting.com/game/super-nintendo/stunt-race-fx
super-nintendo,Sunset Riders,10/1/1993,Teen,Unkown,Konami,Action & Adventure,083717150121,7112,"You're the fastest gun in the West and a bounty hunter voted most popular by the Dodge City Undertaker's Union. But look what's waiting to knock you off your high horse:
Shotgun blast for shotgun blast, this game features the same 7 levels you had a showdown with at the arcade. Doesn't that make your trigger finger itch like crazy?!
Lead will fly non-stop from authentic old west towns, to desert ambush zones, to Indian villages.
Catching up to train robbers and stagecoach bandits will not only exhaust your horse, it'll make you feel like you've just run a marathon with a cactus in your shorts.
Search for the hideouts of Hawkeye Hank Hatfield, the Smith Brothers and other notorious outlaws. Along the way be sure to round up special weapons that'll quicken your draw and double your firepower.
As a real ladies' man, you'll also be rewarded handsomely for your efforts off the trail. Talk about riding into the sunset!
If you think beans and a campfire don't mix, wait'll you see what hits the fan when you mix it up with desperadoes in the bonus bounty stage.
Not enough? Oh, buffalo chips - you know it is!
Heck, even Clint in his prime (many moons ago) would find this game a fistful.",https://www.pricecharting.com/game/super-nintendo/sunset-riders
super-nintendo,Super 3D Noah's Ark,1/1/1994,Unkown,Wisdom Tree,Wisdom Tree,FPS,016315440080,19251,"It's been a long journey. In just a few days, the ark doors will open and Noah, his family & the animals will be back on dry land. But the animals have become a bit restless and are out of their cages. Camels, giraffes, monkeys, kangaroos and more are wondering throughout the corridors of the ark. As Noah, it's your job to regain order & get the animals to sleep until you leave the ark. You only tool to accomplish this in the food you brought aboard the ark.",https://www.pricecharting.com/game/super-nintendo/super-3d-noah's-ark
super-nintendo,Super Adventure Island,4/1/1992,Unkown,Hudson Soft,Produce!,Action & Adventure,039854000164,7113,"Master Higgins is back in his wildest and greatest adventure of all! His girlfriend, Jeannie Jungle, has been turned to stone by the evil Dark Cloak. Now he must leap into action to defeat the scores of guardian animals and monsters that protect the wicked wizard. Join Master Higgins as he reaches new heights of adventure on his high flying skateboard. Speed through underground caves in a crazy mine car ride! Go from tropical shores to the belly of a whale - all in search of his final battle with the mad magician, Dark Cloak!",https://www.pricecharting.com/game/super-nintendo/super-adventure-island
super-nintendo,Super Adventure Island II,10/1/1994,Everyone,Unkown,Unkown,Action & Adventure,039854000263,7114,"Master Higgins finally marries his lovely girlfriend Tina. But out of nowhere, a powerful tropical cyclone destroyed the idyllic mood of their honeymoon. And not only this: it separated the ardent lovers again. After the winds stopped blowing, Tina found herself somewhere on a tropical coast. As for Master Higgins, he went to the king of Waku-Waku and, along with his main quest to save his brand new wife, got an assignment to save also a princess, whom the king was about to marry. Is there a connection between those two events?..",https://www.pricecharting.com/game/super-nintendo/super-adventure-island-ii
super-nintendo,Super Alfred Chicken,2/1/1994,Everyone,Unkown,Unkown,Action & Adventure,050047113737,7115,"Alfred the chicken must rescue his friends and his bird (pardon the pun) Floella from the Meka Chickens. The result is a platform game across differently-themed levels, which are finished by either climbing to the top of the level or killing a boss. Bonus games and secret rooms have been included, and progression sometimes requires solving positional puzzles.",https://www.pricecharting.com/game/super-nintendo/super-alfred-chicken
super-nintendo,Super Aquatic Games,12/1/1993,Unkown,Unkown,Unkown,Sports,044499006075,7116,"The Super Aquatic Games was conceived partly as an Olympics tie-in, and partly as a stop-gap for James Pond fans (the third platform title in the series (Operation Starfish) was in the process of being heavily delayed, eventually being released in 1994). This game saw Pond and friends competing in the underwater Olympics.",https://www.pricecharting.com/game/super-nintendo/super-aquatic-games
super-nintendo,Super Baseball 2020,7/1/1993,Everyone,Midway,Unkown,Baseball,031719199310,7117,"Welcome to the year 2020, where baseball has evolved into a contest between human and machine! Enter the futuristic Cyber Egg Stadium and test your skill in 2 world-class leagues with a total of 12 different teams! Step up to the plate and play the most mind-blowing baseball game ever seen:",https://www.pricecharting.com/game/super-nintendo/super-baseball-2020
super-nintendo,Super Baseball Simulator 1.000,12/1/1991,Everyone,THQ,Unkown,Baseball,047743950162,6852,Super Baseball Simulator 1.000 is a 1991 traditional baseball simulation video game by Culture Brain for the Super NES that is the sequel to the NES game Baseball Simulator 1.000. This game is called Super Ultra Baseball (??????????????) in Japan.,https://www.pricecharting.com/game/super-nintendo/super-baseball-simulator-1000
super-nintendo,Super Bases Loaded,9/1/1991,Everyone,Jaleco,Unkown,Baseball,032264700013,7118,"Super Bases Loaded 2 is the 16-bit remake of the original NES versions. It features the modes Exhibition, Season, and All Star and features a battery backup that will allow the player to keep track of stats and resume play at their own leisure.",https://www.pricecharting.com/game/super-nintendo/super-bases-loaded
super-nintendo,Super Bases Loaded 2,2/1/1994,Everyone,Unkown,Unkown,Baseball,032264700136,7119,"Super Bases Loaded 2 is the 16-bit remake of the original NES versions. It features the modes Exhibition, Season, and All Star and features a battery backup that will allow the player to keep track of stats and resume play at their own leisure.",https://www.pricecharting.com/game/super-nintendo/super-bases-loaded-2
super-nintendo,Super Bases Loaded 3,5/1/1995,Everyone,Unkown,Unkown,Baseball,032264700204,7120,"Super Bases Loaded 3 is the follow-up to Super Bases Loaded 2 which includes updated stats of over 700 actual MLBPA players including Barry Bonds, Kirby Puckett and Terry Gwynn, just to name a few. The modes of play include the standard Exhibition and Season, but also include a Championship Tournament and an MVP Game. However, since there is no MLB license, there are no team nicknames or logos, and also no World Series is included in the game. The game only contains three generic stadiums. A battery back-up is present that allows players to save games.",https://www.pricecharting.com/game/super-nintendo/super-bases-loaded-3
super-nintendo,Super Batter Up,10/1/1992,Everyone,Namco,Unkown,Baseball,7.22674E+11,13071,"Super Batter Up is a baseball game with both a 1 and 2 player mode plus a league mode. The game carries the MLBPA license, but not an MLB license, so it only features all the players from the 1991 season playing for a team in a city that they really play for. Players get to play in either a dome, modern, or traditional stadium each with their own unique characteristics.",https://www.pricecharting.com/game/super-nintendo/super-batter-up
super-nintendo,Super Battleship,11/1/1993,Everyone,Mindscape,Synergistic Software,Other,050047113768,7122,"This game features two different modes of play: Classic Battleship and Super Battleship. Classic Battleship is the typical Battleship game where the players set up their ships on a grid, then take turns choosing 3 places at a time to target and hope they hit the opposing players ship. The game ends when all the opposing players ships are sunk. This mode contains four difficulty levels: Ensign, Lieutenant, Commander, and Admiral.",https://www.pricecharting.com/game/super-nintendo/super-battleship
super-nintendo,Super Battletank 2,1/1/1994,Everyone,Absolute,Unkown,Action & Adventure,018706113931,7123,"In this sequel to Super Battletank, the player takes control of the feared M1A2 Battletank in 16 missions centered in the Middle East. After they are attacked by an unknown group of enemies on both land and air, the player is tasked to root out these enemies and stop any further attacks on Coalition forces.",https://www.pricecharting.com/game/super-nintendo/super-battletank-2
super-nintendo,Super Battletank War in the Gulf,12/1/1992,Everyone,Absolute Entertainment,Absolute Entertainment,Action & Adventure,099451809782,7459,"In February 1991, The United States of America sent troops into Kuwait and fought in armed combat against the forces of Iraq. Operation Desert Storm featured many different types of units including mobile armor. The M1 Abrams tank division is deployed in a variety of missions to destroy marked Iraqi targets.",https://www.pricecharting.com/game/super-nintendo/super-battletank-war-in-the-gulf
super-nintendo,Super Black Bass,5/1/1993,Everyone,HOT-B,Unkown,Sports,093455100111,7124,"Super Black Bass is a bass fishing game where players can compete in four different lake tournaments. Player can fish in: Skywater Lake (Local Amateur), Clear Lake (Amateur), Murphy Lake (Pro) and Bluestone Lake (Super Bass), the goal of which is to catch a certain weight limit of bass before a certain time limit.",https://www.pricecharting.com/game/super-nintendo/super-black-bass
super-nintendo,Super Bomberman,9/1/1993,Everyone,Unkown,Unkown,Party,039854000232,14547,"Super Bomberman is an updated version of the overhead strategy-fighter game Bomberman on the Nintendo Entertainment System. It the first video game in the Bomberman series to appear on the Super Nintendo Entertainment System. It is also the first four-player game to be released on the Super NES. Early versions of Super Bomberman came bundled with the Super Multitap accessory, allowing four controllers to be used on the system.",https://www.pricecharting.com/game/super-nintendo/super-bomberman
super-nintendo,Super Bomberman 2,9/1/1994,Everyone,Hudson,Unkown,Party,039854000331,7125,"Five evil cyborgs, called the Five Dastardly Bombers are bent on taking over the universe. At the planet Earth, they capture the original Bomberman, and he is placed in a prison cell in their base. He awakens in the dungeon of Magnet Bomber and must fight his way to a final showdown with the Magnet Bomber himself. In the following four levels, Bomberman will challenge Golem Bomber, Pretty Bomber, Brain Bomber, and their leader, Plasma Bomber in an effort to free the Earth of these alien invaders as well as save himself.",https://www.pricecharting.com/game/super-nintendo/super-bomberman-2
super-nintendo,Super Bomberman Party Pack,1/1/1993,Unkown,Unkown,Unkown,Party,Unkown,34653,,https://www.pricecharting.com/game/super-nintendo/super-bomberman-party-pack
super-nintendo,Super Bonk,11/1/1994,Everyone,Unkown,Unkown,Action & Adventure,039854000294,7127,"The fourth game in the regular Bonk caveman series, Bonk is back on his first Super Nintendo outing.",https://www.pricecharting.com/game/super-nintendo/super-bonk
super-nintendo,Super Bowling,9/1/1992,Everyone,Unkown,Unkown,Sports,095303284028,7128,"Super Bowling is a third-person bowling game. Players may bowl in several different environments, which range from ice ponds to neon-lit Chinese temples. Players can face-off against characters in their home stages, much like a fighting game. If the player wins they can then play on these stages in other play modes.",https://www.pricecharting.com/game/super-nintendo/super-bowling
super-nintendo,Super Buster Bros.,10/1/1992,Everyone,Unkown,Unkown,Shoot'em Up,013388130085,7129,"Super Pang is an adventure for one or two players that takes the player around the world, aiming to rid the planet of a terrible foe: seemingly innocuous-looking bubbles. The main portion of the game is Tour mode, where the player visits a series of different levels representing different countries of the world. Each player's character is armed with a gun, which shoots a vertical cable. If this hits a bubble, it will cause it to split in two. Upgrades allow two cables to be shot at once, or the ability to stick a cable to the ceiling where it will cling for a few seconds, bursting any bubble that hits it.",https://www.pricecharting.com/game/super-nintendo/super-buster-bros
super-nintendo,Super Caesar's Palace,10/1/1993,Everyone,Virgin,Unkown,Other,052145840065,13818,"Super Caesars Palace is the upgraded sequel to the original Caesars Palace for the NES. This version features nine different games to choose from: Blackjack, Keno, Roulette, Scratchers, Horse Racing, Red Dog, Craps, Video Poker and Slot Machines, each with their own degree of difficulty and strategy.",https://www.pricecharting.com/game/super-nintendo/super-caesar's-palace
super-nintendo,Super Castlevania IV,12/1/1991,Teen,Konami,Unkown,Action & Adventure,083717150015,7130,"A century of Transylvanian tranquility is about to come to a shocking end. Once again the mortifying screams of helpless villagers shake the ground as they huddle against new nightmarish horrors unleashed by the Duke of Darkness, Count Dracula. And this time he has a tombstone with your name on it, Simon Belmont.",https://www.pricecharting.com/game/super-nintendo/super-castlevania-iv
super-nintendo,Super Chase HQ,12/1/1993,Teen,Unkown,Unkown,Action & Adventure,020588010758,7131,"A high-speed chase to run down crime! The suspects are pulling away, so you rev up to 180 m.p.h. The city passes in a blur, then some fool pulls out in front of you! Tires scream and snarl, grabbing the road as you slam on the brakes and whistle past a telephone pole! You race back up to 200 m.p.h. and close on the criminals.",https://www.pricecharting.com/game/super-nintendo/super-chase-hq
super-nintendo,Super Conflict,3/1/1993,Teen,Unkown,Unkown,Action & Adventure,034912784734,7132,"Super Conflict: The Mideast is a strategy game that compares itself to a game of chess: there are two sides (Blue or Red) who must destroy the opposing force's Flag Unit. (In the fifth skill level, there is also a Flag Ship, and the game is lost if either one is destroyed.) Scenarios are laid on on a hexagonal grid, and each space has its own terrain type and can be occupied by one unit. You move your units around and attack enemy units in adjacent hexagons. There are also cities, airports, and shipyards, which you can occupy and use for your own purposes (ie. to repair a unit). Depending on the skill level or scenario you can also construct factories to produce additional units.",https://www.pricecharting.com/game/super-nintendo/super-conflict
super-nintendo,Super Copa,11/1/1993,Everyone,ASC,Sculptured Software,Soccer,7.29627E+11,31345,"Super Copa is essentially a Spanish and Portuguese version of Tony Meola'a Sidekicks Soccer. It is developed by Sculputured Software and uses the same game engine that was used in NCAA Basketball and NHL Stanley Cup Hockey. It seems like a fairly decent soccer game, and certainly plays better than NHL Stanley Cup. The game is considered a rarity and it may have only been distributed in Latin American countries.",https://www.pricecharting.com/game/super-nintendo/super-copa
super-nintendo,Super Double Dragon,10/1/1992,Everyone,Tradewest,Technos Japan,Beat'em Up,031719199211,7133,"Super Double Dragon, released in Japan as Return of Double Dragon: Sleeping Dragon has Awoken, is a side-scrolling beat-'em-up released for the Super Nintendo Entertainment System in 1992. It was published by Tradewest in North America and the PAL region and by Techn≈çs Japan in Japan. Super Double Dragon is the fourth console game in the Double Dragon series developed by Technos Japan, following Double Dragon III: The Sacred Stones for the NES. The game did not have an arcade release and was made specifically for the home market.",https://www.pricecharting.com/game/super-nintendo/super-double-dragon
