Console,Title,Release_Date,ESRB,Publisher,Developer,Genre,UPC,PC_ID,Summary,URL
super-nintendo,3 Ninjas Kick Back,11/1/1994,Everyone,Sony Imagesoft,Malibu Interactive,Beat'em Up,7.35009E+11,6828,"You first saw Rocky, Colt and Tum Tum on the silver screen when their martial arts skills and extreme exploits saved the honor of Grandfather Mori and defeated an evil arms dealer. Now, it‚Äôs up to you! In this action-packed adventure, you become any one of the 3 Ninjas. And that‚Äôs when the fun begins. Wild animals and even wilder ninjas attack! A trio of spaced-out heavy metal rockers join forces with the evil Koga in an all-out effort to do you dirty. But of you rescue Grandfather Mori and his ceremonial dagger, you‚Äôll have the last laugh‚Ä¶and unlock a secret room filled with more gold than Fort Knox!",https://www.pricecharting.com/game/super-nintendo/3-ninjas-kick-back
super-nintendo,AAAHH Real Monsters,11/1/1995,Kids to Adults,Viacom,Realtime Associates,Platformer,040824212036,7258,"Greetings, terror-trainees! Ickis, Krumm, and Oblina will have to prove themselves on the Monster midterm exams if they want to call themselves real monsters! They must work together as a team to receive a single gruesome grade on their frightful performance. So...go out and petrify someone!",https://www.pricecharting.com/game/super-nintendo/aaahh-real-monsters
super-nintendo,ABC Monday Night Football,12/1/1993,Everyone,Data East,Data East,Football,013250011054,13002,"ABC's Monday Night Football gives you football action like you've never seen before! This is the only game that takes you from the bright lights of the announcer's booth to the gut-wrenching action on the field. You are the Quarterback - check off your receivers and find the open man. Now you're the wide receiver - catch the winning touchdown as the crowd goes wild! You'll feel the hits, hear the grunts and experience football as only the best players can. You are the action! You set the formations and you call the plays! This is the game you've been waiting for!",https://www.pricecharting.com/game/super-nintendo/abc-monday-night-football
super-nintendo,ACME Animation Factory,11/1/1994,Everyone,Sunsoft,Probe Software,Educational,020763110426,13003,"In ACME Animation Factory, the player is given a series of tools to create his or her own cartoons, using the most famous characters of Looney Tunes, including graphics, animation and music. When the cartoon has been created, it can be saved and later replayed.",https://www.pricecharting.com/game/super-nintendo/acme-animation-factory
super-nintendo,ActRaiser,11/1/1991,Everyone,Enix,Quintet,Action & Adventure,7.19631E+11,6830,"Restore peace and order to your people's world! Long ago, you and your people built a peaceful land. Since then, your world has been taken over and inhabited by the evil Tanzra and his Guardians. Your once-tranquil land has become a breeding ground for monsters. Injured, you have retreated to your Sky Palace and have fallen into a deep sleep.",https://www.pricecharting.com/game/super-nintendo/actraiser
super-nintendo,ActRaiser 2,11/1/1993,Everyone,Enix,Quintet,Platformer,7.19631E+11,6831,"Gameplay for ActRaiser 2 consists primarily with side-scrolling platform action, similar to the Professional!/Action mode from the original game. The player, assuming the role of the Master (still referred to as God in the Japanese version), controls a floating palace to inspect the people of the world below. After hearing their plight the Master descends to the world below to fight the monsters and rid the land of evil. Like the original, each area contains two acts; the first act of an area consists of monsters spawned from a lesser demon named after an unfavorable condition, while the second act consists of monsters spawned from the primary evil, named after one of the seven deadly sins, with heightened challenge and peril.",https://www.pricecharting.com/game/super-nintendo/actraiser-2
super-nintendo,Addams Family Pugsley's Scavenger Hunt,2/1/1993,Everyone,Ocean,Ocean,Platformer,020295030094,6832,"Darling little Pugsley has lost his family to kidnappers who have hidden them as prisoners in their own spooky home. Only lovable little Pugsley can rescue them by hunting for delightfully strange items located in secret spots in their weird mansion. What oddities and atrocities await him! There are twisted creatures and complex features at every turn of the task.
If precious little Pugsley is able, he'll find and rescue Gomez, Granny, Wednesday and Uncle Fester and see them to the music room. Each one holds a piece of the unnaturally lovely music which Lurch must play to unlock the secret passage leading to Morticia.
Pugsley's only helper is the charmingly bizarre Thing, who brings him startling messages to help him along.
So get ready to get spooky and get set to get kooky... it's Pugsley's Scavenger Hunt!",https://www.pricecharting.com/game/super-nintendo/addams-family-pugsley%27s-scavenger-hunt
super-nintendo,Addams Family Values,2/1/1995,Kids to Adults,Ocean,Ocean,Action & Adventure,020295030155,6833,"Baby Pubert, the most recent addition to the Addams Family, has been abducted by Debbie Jellinski, his former nanny. As Uncle Fester it is your job to rescue little Pubert. You must search the surrounding areas (forests, swamps, gardens and the like) of Addams mansion, while avoiding traps, solving puzzles and killing monsters. You'll face such hellish creatures as vultures, gargoyles, bats, ghosts and ghouls.",https://www.pricecharting.com/game/super-nintendo/addams-family-values
super-nintendo,Advanced Dungeons & Dragons Eye of the Beholder,3/1/1994,Everyone,Capcom,Strategic Simulations,RPG,013388130146,7316,"Darkness has engulfed the town of Waterdeep and legend has it that the criminal conspiracy behind it is hiding in the sewers. The locks and the traps in the twisting labyrinth beneath Waterdeep are too good and Skeletons and Kolbolds lurk around every corner. Who could be at the heart of this evil? And can anyone survive to find out?
In Eye of the Beholder, you take control of a band of four adventurers as they seek to unravel the mysteries beneath Waterdeep. Using an easy to use Point and Click interface and 3-D point of view, you become part of the action as you do battle with Mind Flayers and Mantis Warriors who seek to put an end to your mission to purge Waterdeep of the evil.",https://www.pricecharting.com/game/super-nintendo/advanced-dungeons-&-dragons-eye-of-the-beholder
super-nintendo,Adventures of Batman and Robin,12/1/1994,Everyone,Konami,Konami,Action & Adventure,083717150152,7261,"There are games and there are cartoons. Now there is The Adventures of Batman and Robin. What's the difference? you ask. Precisely, Batman battles through the eight toughest levels of villainy to hit your TV screen. You'll be dazzled by the animation-style graphics. You'll be awed by great sound and a stirring musical score. You'll swear you were watching the hit animated series except for one tiny detail. YOU CONTROL THE ACTION! Using a combination of brains and brawn, you decide the fate of Gotham City as you strategically lead Batman on his mission to eradicate violence and mayhem. Operating out of the top secret Batcave, you'll use smoke bombs, Batarangs, x-ray goggles and all the weapons your utility belt can hold as you swing across rooftops and dash through dark alleys, tracking down the elusive Catwoman. You'll try to put a stop to Two-Face as you race through the streets in the Batmobile. You'll enlist the aid of Robin to put The Penguin out of business. You can't relax though, because Scarecrow, The Joker, Poison Ivy, Clayface and their motley crews will crush you and take control of Gotham City!",https://www.pricecharting.com/game/super-nintendo/adventures-of-batman-and-robin
super-nintendo,Adventures of Dr Franken,12/1/1993,Everyone,DTMC,MotiveTime,Platformer,7.39712E+11,7262,"Franky and his girlfriend Bitsy have decided to take a vacation. Unfortunately, Bitsy does not have a passport. Not to be thwarted, our spare parts hero has a cunning plan. He dismantles Bitsy, packages up her parts and mails them to their vacation destination - New York City - with predictable results. The combination of Franky's lack of brain cells and the incompetence of the Transylvanian post office has scattered Bitsy across the globe. And so, the adventure begins...",https://www.pricecharting.com/game/super-nintendo/adventures-of-dr-franken
super-nintendo,Adventures of Mighty Max,2/1/1995,Everyone,Ocean,WJS Design,Platformer,020295050160,7263,"Wear The Cap. Be The Max. Save The Planet.

You've seen every episode. You know all his moves. The question is...are you ready to wear the magic cap???

Dust off your traveling shoes - it's time to play Mighty Max! SkullMaster has scattered pieces of the mighty doom weapon all over the planet. Go solo or double the action in 2-Player Split Screen mode, and embark on an earth-saving scavenger hunt through time.

Time travel to 50 different worlds. Crush SkullMasters evil minions. Save the planet. Have more fun than watching the cartoon!

Double The Action With 2-Player Split Screen Play!

- Team up with Felix and Bea and warp to cool places like the jungle and outer space.
- Time travel with - or race against - a buddy in incredible 2-Player Split Screen Play.
- Be the Max and unleash your tennis ball cannon on restless natives and goofy aliens.
- Its 50 levels of MAXimum adventure - all based on your favorite Saturday morning cartoon.",https://www.pricecharting.com/game/super-nintendo/adventures-of-mighty-max
super-nintendo,Adventures of Yogi Bear,10/1/1994,Everyone,Cybersoft,Blue Turtle,Platformer,043948510224,8473,"Here comes Yogi! America's favorite cartoon bear is coming to the Super Nintendo Entertainment System. Help Yogi Bear make his was past the furry denizens of Jellystone Park. Collect picnic baskets and other goodies as you travel through the different areas of the park in an attempt to save Jellystone from industrial developers.
-	Fast-paced excitement with wild beaver surfing and mine cart riding.
-	Beautifully animated multi-layered parallax scrolling.
-	Cool Yogi music.
-	Five different areas at the park to explore.
-	Yogi‚Äôs mission will challenge even the most skilled players.",https://www.pricecharting.com/game/super-nintendo/adventures-of-yogi-bear
super-nintendo,Aero Fighters,11/1/1994,Everyone,Mc O'river,Video System,Shoot'em Up,7.24818E+11,12576,"The world's hope hinges on your combat skills and sheer determination as an aero fighter. Defend the world from unknown alien forces that are attempting to take over the world. You must extract these unknown forces before they can execute their plot for dominance. After conquering the unknown forces, the battle continues into space where the controlling intellect dictated the take-over attempt. You must seek and destroy this evil force to prevent it from seizing other worlds.",https://www.pricecharting.com/game/super-nintendo/aero-fighters
super-nintendo,Aero the Acro-Bat,10/1/1993,Everyone,Sunsoft,Iguana,Platformer,020763110310,8475,"Step right up to the acro-battiest show on earth! The madman industrialist Edgar Ektor has seized control of the World of Amusement. He and a deranged cast of fairground freaks threaten the circus. The only hope for survival is the high-flying, death-defying Aero the Acro-Bat! 
Spine-tingling terror unfolds as Aero tackles Ektor's wicked henchmen. Bungee jump into a battle with evil! Skydive in mode 7 toward the danger below. Hang on for the ride of your life as you rise and plunge on a roaring roller coaster! Tiptoe across a terrifying tightrope! Then power drill and twist Aero right through every sinister circus enemy imaginable. And all the while, the show must go on!",https://www.pricecharting.com/game/super-nintendo/aero-the-acro-bat
super-nintendo,Aero the Acro-Bat 2,11/1/1994,Everyone,Sunsoft,Iguana,Platformer,020763110464,6835,"The aerialist extreme, Aero the Acro-Bat bounds back into the spotlight once again to stop the wicked industrialist, Edgar Ektor! Aero has entered a new realm of enchantment and must now use all his acrobatic prowess to foil a criminal plot known only as Plan B! Join Aero as he discovers new friends (and enemies) in a world custom built for his high-flying adventures.",https://www.pricecharting.com/game/super-nintendo/aero-the-acro-bat-2
super-nintendo,Aerobiz,2/1/1993,Everyone,KOEI,KOEI,Strategy,040198000512,6836,"You're ambitious and you strive for excellence. Your goal is to create a global airline network. You know travelers depend on your airline to get them where they want to go. Now convince them your airline is the best way to fly!
A clean safety record, ad campaigns and special services will distinguish you from the rest. As your network expands, establish hub offices and invest in a hotel chain. Tourism will boost income and win passengers away from your competitors. Be aggressive and maintain superiority in the skies.",https://www.pricecharting.com/game/super-nintendo/aerobiz
super-nintendo,Aerobiz Supersonic,8/1/1994,Everyone,KOEI,KOEI,Strategy,040198000741,6837,"It's the beginning of the 21st century and competition in the airline industry is heating up. As a young, ambitious CEO, it's up to you to make sure your airline is a survivor and not just another casualty. To succeed, you will have to make some tough decisions including where to fly, which planes to purchase and how to attract visitors to the cities you service. Your goal: to differentiate your airline from the rest while still turning a profit. Get ready to make some tough decisions! If you make the right ones, your planes will dominate the skies of the 21st century!",https://www.pricecharting.com/game/super-nintendo/aerobiz-supersonic
super-nintendo,Air Cavalry,6/1/1995,Kids to Adults,Cybersoft,Synergistic,Simulation,043948600024,13004,"Air Cavalry is a one or two-player, dual mode-7 game in which each player controls a high-tech helicopter gunship. Flying above the desert, ocean or jungle, the players will accomplish a series of missions from recon to full assault. Recon missions will use the OH-6 Defender. Transport and rescue missions will use the UH-60 Black Hawk. Attack missions will use either the AH-64H Apache or the futuristic AH-94. Air Cavalry. Choose from three theatres of operations with six to eight missions of increasing danger and complexity. Practice in the training mission, climb into your automated cockpit and prepare for air war.",https://www.pricecharting.com/game/super-nintendo/air-cavalry
super-nintendo,Al Unser Jr.'s Road To The Top,11/1/1994,Everyone,Software Toolworks,Radical Entertainment,Racing,050047114857,6838,"Have You Got The Drive To Make It To The Top?
Start as a novice, learn the courses, and race your way to the professional Indy Circuit the same way Al Unser Jr. did! Four different styles of racing and four entirely different vehicles with one- or two-player simultaneous action:

- Go-karts on twisting dirt tracks.
- Souped-up snowmobiles on slippery snow courses.
- Hot, high-horsepower IROC racers.
- Indy cars on the fastest tracks of all!

Race hard and place high to take on the ultimate challenge of Pike's Peak!

It won't be easy to race to the top - this is a challenge you'll want to come back to again and again! If you're the best, you'll make it to the final showdown against Al Unser Jr. himself! The thrill come from hanging in there until you reach the top!",https://www.pricecharting.com/game/super-nintendo/al-unser-jr%27s-road-to-the-top
super-nintendo,Aladdin,11/21/1993,Everyone,Capcom,Capcom,Platformer,013388130122,6839,"Discover a Whole New World of Adventure... For years, Jafar, the Sultan's evil advisor has sought a magic treasure - a single lamp that holds the key to the greatest power in the world. With this goal in sight, Jafar learns that only one person in the world can claim the magic lamp from the dreaded Cave of Wonders - one whose rags hide a heart that is pure - a diamond in the rough! Join Aladdin and his pet monkey Abu, as they race through the marketplace toward their date with destiny. Watch as Jafar tricks our hero and his friend into retrieving the lamp from the dangerous Cave of Wonders. But Aladdin and Abu outwit Jafar, releasing the power of a wacky blue Genie! Now Aladdin will have the chance to spoil Jafar's devious plans and win the hand of the beautiful princess Jasmine. But it will take more than magic to make his wishes come true...",https://www.pricecharting.com/game/super-nintendo/aladdin
super-nintendo,Alien 3,5/1/1993,Everyone,LJN,Probe Software,Platformer,023582087061,6840,"The ALIENS are fast, spit acid and are right behind you! The motion tracker is your only warning. No time to think, no time to catch your breath... RUN! Can't see very far ahead in these air ducts. Hard to breathe. Face-huggers can be anywhere. You have the firepower... blast the ALIENS with your machine gun, flame thrower and grenade launcher. You know what you have to do... rescue the trapped prisoners and end this nightmare! Just keep telling yourself, This isn't really happening. It's only a game!!!",https://www.pricecharting.com/game/super-nintendo/alien-3
super-nintendo,Alien vs Predator,9/1/1993,Everyone,Activision,Jorudan,Beat'em Up,047875540026,10414,"The Cosmic Clash of the Century

You're a Predator warrior in the 25th century-an awesome monster with an ugly face, brute strength and very cool weapons. Trained to fight with all that Predator technology has to offer-destroy or be destroyed!
You've come to New Shanghai, a city on the planet Vega 4, to hunt humans, but instead you find Aliens-powerful, double-jawed beasts bent on annihilating life. You're outnumbered, but not outsmarted-the hunt is on.
Alien drones, warriors, chest-bursters and face-huggers stand in your way. Use your lasers, blades and special weapons of destruction to win honor for your deeds. Destroy the Guardian Aliens to advance to the next level, then follow your primal instinct to reach the ultimate prey...the Alien Queen!",https://www.pricecharting.com/game/super-nintendo/alien-vs-predator
super-nintendo,American Gladiators,4/1/1993,Everyone,GameTek,Imagitec Design,Sports,043948510101,6841,"Television's most innovative sporting event, AMERICAN GLADIATORS is now the most innovative sports game available for the Super Nintendo Entertainment System. Seven events including: The Wall, The Joust, The Assault, Human Cannonball, Atlasphere, Powerball and The Eliminator, all captured with digitized photography, and life-size combat.  We‚Äôve included all of the action, drama, and competitiveness, right down to the personalities and profiles of all the real-life Gladiators. NITRO, ICE, LASER, THUNDER, GOLD, TURBO, ZAP, LACE, BLAZE and GEMINI are here and just like their television counterparts, they‚Äôll never give in without a fight to the finish. With tournament play, scoring, game rules and arena design taken right from the show, this game is as real as it gets. GameTek‚Äôs AMERICAN GLADIATORS for your Super Nintendo Entertainment System, is survival of the fittest.",https://www.pricecharting.com/game/super-nintendo/american-gladiators
super-nintendo,An American Tail Fievel Goes West,8/1/1994,Everyone,Hudson,Shimada Kikaku,Platformer,039854000362,6842,"The Mousekewitz family has been lured out west by the dastardly Cat R. Waul. He plans to round up all the mice in one place and turn them all into mouseburgers. Fievel and you are their only hope. Mosey on down through five challenging stages along with Fievel on a wild west adventure to rescue his family. So buckle up your six shooter, you're the only hope to help Fievel save his family.",https://www.pricecharting.com/game/super-nintendo/an-american-tail-fievel-goes-west
super-nintendo,Andre Agassi Tennis,5/1/1994,Everyone,TecMagik,Radiance,Sports,7.51571E+11,6843,Andre Agassi's explosive smash is yours! Control the court with the Champion's searing baseline attacks. Trade shots with Agassi or sweat out your strategy game against 7 other players with completely unique styles.,https://www.pricecharting.com/game/super-nintendo/andre-agassi-tennis
super-nintendo,Animaniacs,11/1/1994,Everyone,Konami,Konami,Action & Adventure,083717150183,6844,"The Brain stole Hollywood's hottest new movie script. As the Warner Bros. CEO, I'm giving you (and the Animaniacs) the job of finding the script's missing scenes by searching through 7 Warner Bros.' movie sound stages filled with hilarious hijinks. Watch for Tinsel Town Traps and Movie Classic Power Ups scattered throughout the Ocean of Door, Adventure Kingdom, Sci-Fi Scene and Fantastic Fantasy Zone.",https://www.pricecharting.com/game/super-nintendo/animaniacs
super-nintendo,Arcade's Greatest Hits Atari Collection 1,12/31/1996,Kids to Adults,Midway,Digital Eclipse,Arcade,031719199716,30262,"Blast your way through an asteroid field and destroy enemy ships in Asteroids! Super Breakout tests your eye-hand coordination as you break through walls one brick at a time! Enjoy the non-stop action of a never-ending stream of attacking insect infestation in the classic arcade hit, Centipede! In Tempest, you'll use unlimited firepower to shoot and destroy your enemies in a large geometric battlefield! Missile Command lets you rescue humanity from a nuclear holocaust as enemy missiles, bombers and satellites rain warheads on populated cities and missile bases! It's all-out war as you destroy enemy tanks, guided missiles and alien spacecraft in Battlezone!",https://www.pricecharting.com/game/super-nintendo/arcade%27s-greatest-hits-atari-collection-1
super-nintendo,Arcana,5/1/1992,Everyone,HAL Laboratory,HAL Laboratory,RPG,040458855043,6845,"Arcana - 1. Mysterious knowledge known only to initiates. 2. Ancient rites and spiritual powers understood by only a few. 3. The secrets held by the Card Mastersnow fast disappearing.
The art of the Card Masters has gradually died out. None of the young people want to learn the ancient system of casting spells and calling up spirits using the cards.
But an evil conspiracy has taken hold of the kingdom. Rooks, descended from the last of the true Card Masters, is recruited to overthrow the sinister regime. Relying on what little he knows of the ancient art, learning along the way, trusting no one. Rooks sets out on a journey to restore order and save his homeland. Only a Card Master can do it.",https://www.pricecharting.com/game/super-nintendo/arcana
super-nintendo,Ardy Light Foot,2/1/1996,Kids to Adults,Titus,ASCII,Platformer,091493042929,6846,"The rainbow has been broken into 7 pieces! Ardy, our young and brave adventurer, with Pec, his friend-for-ever, are ready to sacrifice their lives to gather the 7 gems containing the colors of the rainbow, then their wishes will come true and they will finally save Nina from the clutches of Visconty.",https://www.pricecharting.com/game/super-nintendo/ardy-light-foot
super-nintendo,Arkanoid Doh It Again,11/1/1997,Kids to Adults,Nintendo,Taito,Arcade,020588010833,6847,"Arkanoid, one of the best-selling, most loved video games in history is back with more challenges and special features than ever before! In your scout ship, you will be racing through a galaxy crowded with solar block and powerful enemies, clearing the path with laser beams and energy balls.

Test your reflexes in 99 levels of twisting puzzles, or use EDIT to build your own course. 9 types of power capsules drop from shattered blocks, changing the capabilities of your scout ship. Arkanoid for the Super NES is even compatible with the Super NES Mouse to enhance your maneuvering skills. Two people can play together in one of three simultaneous game modes. Arkanoid has finally made its long-awaited return and will push you to the outer limits!",https://www.pricecharting.com/game/super-nintendo/arkanoid-doh-it-again
super-nintendo,Art of Fighting,12/1/1993,Everyone,Takara,SNK,Fighting,026483340488,6848,"South Town is no place for the weak. Yet into this urban battlezone comes Ryo; braving the mean streets in order to rescue his kidnapped sister.
With this friend Robert, the two must use all their strength and skills to battle and defeat the toughest fighters ever assembled. These fighters are big, powerful, strong - each possess special skills that will be hard to counter. Ryo must master the Super Attacks if he is to be victorious.
Fight hard, fast and furious.
Only the strongest of fighters will survive the streets of South Town.",https://www.pricecharting.com/game/super-nintendo/art-of-fighting
super-nintendo,A.S.P. Air Strike Patrol,1/1/1995,Everyone,SETA,Opus,Shoot'em Up,092826942015,6829,"Zarak has invaded Sweit! You, as Air Force commander, MUST marshall all your resources and defeat them. Using hi-tech intelligence, locate your targets, load your plane, and destroy... chemical weapon plants, radar sites, enemy vehicles, and more. So strap yourself into a cockpit and fly into the challenge of a lifetime.",https://www.pricecharting.com/game/super-nintendo/asp-air-strike-patrol
